title,price,detail,ISBN,review
  The Orphanage By The Lake: A Captivating Psychological Crime Thriller With A Twist ,    $0.00   ,A MISSING GIRL,,"[('Amazon Customer', 'A clever, fun, and intriguing mystery with a captivating lead detective character.  Everyone will fall in love with Hazel Cho.  Really felt like I needed to finish in one-sitting because the inventive details gave it great plot momentum.  I had my suspicions about who did it but kept moving my distrust from one character to another – well written.  Can’t wait for Hazel to have the next case.  You rock girl!'), ('Gailmarie', ""Yeah, it was Explosive!! Can't state it any other way. This author writes with panache. I will be reading other books she pens. He seriously knows how to get a knee jerk reaction. The characters in the book seem to become real; immersing the reader within it's pages and inspires speed reading.""), ('Peggy Kindt', 'I have to state I do not support the theme of the plot, although it\'s a reality all too often in society. This is the type of story that does touch the recesses of the mind; is best described linguistically as ""triggers"" within a person who abhors violence, child trafficking and depraved men and women who give in to evil. SUN; 03242024.')]"
"  365 AWESOME RANDOM USELESS FACTS: Amaze and Annoy others with Awesome Useless Knowledge Fun Facts and Trivia for kids 8-10,10-12, teens, adults, family ",$2.99,Ships from,979-8475950432,"[('Amazon Customer', 'Bought for my Dad and he loved it!'), ('ERJ', 'My kiddo is the king of random facts. He got this book and immediately started rattling off new facts. I plan to get him more!'), ('Ashlee Reagan', 'Ok!')]"
"  You are an Amazing Boy: A Collection of Inspiring Stories about Courage, Friendship, Inner Strength and Self-Confidence (Motivational Books for Children) ", $9.54 ,Ships from,979-1280592507,"[('Amazon Customer', ""This is honestly one of the best books I've ever seen of its kind. Had this been one of the foundational books that my mom or dad had read to me at bedtime when I was a young boy, this book (especially read to me by them) could have changed the trajectory of my life and saved me literally decades of self-hatred and ineffective therapy.""), ('Amazon Customer', 'I\'ve rarely encountered ANY book which paints for a boy a picture of the traits inherent within him that are GOOD. I grew up surrounded and bombarded by late \'60s/early \'70s feminist messages predicated on the idea that men and boys are bad and girls and women were the only ones with the positive traits that the world needed. Wired as a sensitive, intuitive boy, I picked up on the messages that I was inherently bad and that my greatest gift to society would be to elevate and support women ... while determinedly NOT BEING, trying to have my existence have as little impact on women and girls as possible. By age 10, I wanted to die. When a boy hears women saying things within earshot of him like, ""Men are the urine on the toilet seat of life"" (yes, a woman in a group I was in said that), it\'s easy for him in his immature understanding to think that the most altruistic thing he could do for the women and girls of the world would be to die.'), ('Chris Norden', 'But had my parents had read this life-saving book—YOU ARE AN AMAZING BOY—to me at bedtime, I would have grown up knowing—not in a stuck-up way, but rather in a benevolent way—that I was amazing, strong, capable, loving, that as a boy, I had good, helpful and valuable qualities, qualities that were a BLESSING—NOT a curse— to society, to girls and women, to men and other boys, to animals and the planet. And, had I known these things in the way this miraculous book teaches ... what a gift!!')]"
  The Roommate Situation: A Romantic Comedy (Only in Atlanta Book 1) ,    $0.00   ,Conor Brady is the hottest man I have ever laid eyes on. Ever. He’s also my new roommate.,,"[('Amazon Customer', 'The Roommate Situation, book 1 in Katie Bailey\'s Only in Atlanta series, had me smiling, sighing, and snort-laughing--many times, within the same chapter! Jess\'s wry humor and Conor\'s smooth ""explanations"" of ridiculous situations combined in a sweet romance between a frustrated artist and a house flipper staying at his friend\'s house temporarily.'), ('Kindle Customer', 'Jessica Shaw has left her disappointing and disappointed New York City life to return to her hometown of Atlanta. Single, not by choice--her boyfriend of six years cheated on her with a successful corporate woman, while Jess has been waiting tables at a circus themed restaurant and trying to sell any of her paintings. She calls her brother, Aiden, to announce her imminent arrival and cuts off his attempt to prolong the conversation by ending the call, prancing through the door, dropping her bags on the foyer floor...and throwing her beloved fern at the strange man who walks into the room.'), ('@imfullybooked2', ""Conor Brady, just back from a run, escapes uninjured--which is more than can be said for poor Fernie--and vacuums up the potting soil from the hallway carpet. Jess finishes her shower in Aiden's bathroom, emerges from his  bedroom, which she's moved into--typical younger sister behavior--and charms Conor with her down-to-earth personality and cute looks. Meanwhile, she's rendered speechless by his extreme handsomeness and gently teasing comments. Aiden warns his sister, via cell phone from his business trip to L.A., that Conor is a ladies' man, but by then Jess is too far gone."")]"
 Taste: My Life Through Food ,    $0.00   ,Instant ,,"[('Amazon Customer', 'Tucci, S. (2021). Taste: My life through food. Gallery Books.'), ('Alicia Crumpton', 'Stanley Tucci is an actor and a filmmaker.  He brought his love of food in the series Searching for Italy where he took viewers on a food tour of Italy.'), ('Alicia Crumpton', 'I tend to like books that talk about food and Stanley Tucci\'s memoir was wonderful.  His description of pasta left my mouth watering to the point that I made spaghetti that very night.  He begins by talking about his mother\'s love of food:  ""there was a daily, almost obsessive focus on the quality of the ingredients, their careful preparation the passing on of family recipes, and cultural and culinary traditions.""  Weaving stories, recipes, and descriptions of food experiences and traditions we learn about Tucci as a young man, actor, and family man.  We also learn about his values.  For example, his mother exhorted, ""You can\'t know if you don\'t like something if you haven\'t had it.  You have to try it.  You have to try everything.""  He described food as ""connective tissue"" bringing people together.  Tucci noted, ""if you\'re a food lover, there is always something gratifying about connecting with the vegetable, the fruit, or whatever animal, whether you\'ve grown it, raised it, or hunted it, before it becomes your food.  But to make that connection and then connect with someone else simultaneously is an exalted, almost spiritual level of foodie intimacy.""  He reserved his experience of throat cancer until the chapter.  It was as though, the prior chapters were the prelude to fully understanding how threatening oropharyngeal cancer would be to a man who clearly loves food.  His diagnosis meant that for almost two years, he primarily ate easy to swallow foods.  Reflecting, he said: ""Food at once grounded me and took me to other places.  It comforted me and challenged me.  It was part of the fabric that made up my creative self and my domestic self.""')]"
  The Gruffalo , $6.70 ,Ships from,978-0142403877,"[('Amazon Customer', ""It's now a classic in the USA!  Great story with a lot of colorful pages that children love.""), ('Amazon Customer', 'This is kinda like a classic now! I loved that it was red and added it to a stocking for my kid at Christmas. It is a great book that is fun to read!'), ('Nancypants', 'This is one of my favorite books to read to my kids. They enjoy it too! Photos are nice and it has a nice rhyming rhythm making it an easy read! I bought this second copy for a friend when she had her baby!')]"
  Little Blue Truck's Springtime: An Easter And Springtime Book For Kids , $9.36 ,Ships from,978-0544938090,"[('Amazon Customer', 'cute book for my grandson, pictures are bright and colorful. Will definitely purchase more books for him.'), ('Amazon Customer', 'My kids have grown up hearing us read the little blue truck books. Loooove them.'), ('A Roth', 'We read this all the time - so cute!')]"
  Funny Program Director Coloring Book: A Snarky & Sweary Adult Coloring Book For Program Director: Meditative coloring book for Program Director: ... Coworker Coloring BookA Snarky & Swear , $9.99 ,Ships from,979-8397765848,
  Christmas Coloring Book for kids: easy christmas large print coloring book.A Christmas and Winter Coloring Pages For Adults.beautiful christmas coloring book for adult , $8.99 ,Ships from,979-8357768742,
  The Ultimate RPG Character Backstory Guide: Prompts and Activities to Create the Most Interesting Story for Your Character (Ultimate Role Playing Game Series) ,$12.99,Ships from,978-1507208373,"[('Amazon Customer', ""I use this book CONSTANTLY when making new characters or even for filling in gaps after giving a character a break and coming back with a level change.  It's not just for TTRPG characters though; the exercises in this book are also great for creating a character in writing.  Highly recommend this for anyone who plays TTRPGs or writes, whether you struggle with character creation/development or not.  This book is a serious game changer.""), ('Random Bailey', 'This book is a really useful tool for helping generate backstory ideas during character creation. Either for a Player Character or a Non Player Character this book provides a good stepping stone in the process.'), ('Frank D', '  It’s simple and open format is not intended as a specific regimen to be followed for Character Generation nor is it just an endless list of random tables. Instead it is a system neutral collection of brief themed exercises with questions and some random tables. These exercises are written in a way as if a GM were providing a scenario for you or asking you the questions and even have some die rolls for certain resolutions and possibilities.')]"
" Jacksonland: President Andrew Jackson, Cherokee Chief John Ross, and a Great American Land Grab ",    $0.00   ,Jacksonland,,"[('Amazon Customer', ""Most people where I am from have at least heard of the Trail of Tears. I'd say 80% of those people don't know the extent to which this exodus devastated native Nations and mired them in distrust. This book offers a window with a wide view, touching a little on many other nations, but focusing on John Ross, Principle Cheif for the Cherokee, and Andrew Jackson, U.S. general and President. The author draws lines between them for their situations in early life, battles fought together, tenacity, and desire to do what they thought their people wanted. He then drives them apart with Jackson's betray, broken promises, deceit, selfishness, and tangled legal web. The mere fact that Jackson withheld his veto (by a day) on a bill his supporters wanted, just to approve an illegitimate treaty, speaks volumes. It's maddening to know how close Ross was to success. Just a vote--if only the voters had realized they were about to sacrifice their moral compass just to cast their lots with someone who would betray their interests as well.""), ('Danielle', ""I found this book a great resource on all the legal avenues and order of events. It uncovered some great, underlying problems that I hadn't considered in my research.""), ('J. Bristow', ""If people tell you a war was fought over state's rights, they are right, and I hate to admit it. It brewed for decades. A state's right beat, swindle, dispose of, destroy, and displace people who legally live within its perceived borders. To hold a land lottery and give away thriving farms right out from under people's feet. A state's right to ignore the Supreme Court and have Jackson turn a blind eye. The right to buy and sell human beings became the cornerstone, once natives left. Occasionally a state defies federal law in a way we consider moral, but these particular acts wouldn't stand today. At least I hope not."")]"
  8.5x11 DND Campaign Journal: 5E Character Sheet Cover Lined Notebook for DND Players Purple and Orange Fade , $8.49 ,Ships from,,
  Gumdrop Angel: An AFK Book (Five Nights at Freddy’s: Fazbear Frights #8) (8) , $7.99 ,Ships from,978-1338739985,"[('Amazon Customer', ""Overall it's a good book but I did manage to find a typo. In Sergio's Lucky Day, on pages 90-91, (in my copy at least) it mentions two right hands instead of left and right. Otherwise it's all good still.""), ('Amazon Customer', 'This book is an incredible read for young adults. The stories are outright scary, and imagining what happens to each of the three protagonists is goosebump worthy. Absolutely one of the best books in the series.'), ('Rheanna Rowland', 'Cool book lots of lore drops and stuff I’m really just gonna drag out this review I just wanted to leave 5 star review :P')]"
  Class Act (A Stone Barrington Novel Book 58) , $7.99 ,Stone Barrington takes down old and new enemies in the latest thriller from perennial fan favorite Stuart Woods.,,"[('Amazon Customer', 'Stone finds himself cross ways with jealous Mafia person and ( forced ) retired New York City Detective.  The Mafia guy upset that Stone would be with his ( he thought ) girlfriend.  But wait, she is not what she has represented herself to be! Lurking is a the Ex- Detective who never can seem to bet on the right horse losing money to a bookie and needing more to pay debts.'), ('Frank Rush', ""Enter another Mafia guy, now out of the penitentiary where he has stayed to protect the local DON's family member.  Ex Detective making life unhappy for him.""), ('S Griffin', ""Put this all together, add some more ladies to the mix along with Stone's long time friend Dino, New York Police Commissioner,  and Stuart Woods provides excitement and intrigue in a book not to be put down until finished."")]"
  Shapes (Little Scholastic) , $10.92 ,From Little Scholastic comes this innovative and interactive shapes concept book for babies and toddlers!,978-0439021463,"[('C. Pascua', ""I love all the board books in this line. There's consistency in each one, with similar or exactly the same textures and names. It helps solidify the terms in my son's mind. He recognizes the similarities and can easily decipher each thing.""), ('SmR', 'Not Happy, content good but came in very bad shape. Penn marks, dirty and edges are worn out.'), ('RK', 'Price on book is $4.99, I paid over $10.00 with shipping. No quality control!')]"
"  FAIRIES IN A JAR COLORING BOOK FOR ALL AGES: Magical Fairies inside A Jar , Beautiful Illustrations For All Ages . ",Out of Print--Limited Availability.,With,979-8875826245,
  One-Eyed Dream: A Novel (Titus Bass) ,                                             ,One-Eyed Dream,978-0553281392,"[('D. H.', 'I have enjoyed the Titus Bass series by Terry C. Johnston. Think ""Jeremiah Johnson"" spread over nine books. The author tells a good story and has backed it up with research on the fur trapper era. It is too bad he passed away so early.'), ('Kindle Customer', 'Regrettably the middle three books (which were actually the first three written, something like the Star Wars films) are not available in a kindle/e-book format. (Hint! Hint!) I wanted an inexpensive copy to take on a vacation where I could donate, abandon or dispose of the book rather than worry about packing it when I am done. This was the least expensive copy available on Amazon\'s third party sellers at $1.13 + S&H. The seller, Clean Earth Books, rated it as ""Used-acceptable,"" which was what I was looking for. I am happy to say it arrived earlier than the predicted delivery window and was frankly in pretty good condition, much better than I expected. I may even bring it home from vacation.'), ('Kindle Customer', 'If you are a student of history and the development of American western frontier all 10 of these books are very good, informative and a great story of a young man as he grows older and wiser. Johnston, in my opinion is a master of early American western history and storytelling with facts. They must be read in the following order to get the full story:')]"
  Touched By The Devil : Touch Aversion-Trauma Romance (Boys of Preston Prep Book 3) ,    $0.00   ,"After living with my stepfather, I have one rule: Keep your damn hands to yourself.",,"[('Alicia S', '♥️ 📸 Touched By The Devil 📸 ♥️ (Book 3 in the Boys of Preston Prep series) by Angel Lawson & Samantha Rue'), ('Barbie', '5/5 ⭐️'), ('Jennifer', '2/5 🌶️')]"
  27 Truths: Ava's story (The Truth About Love Book 1) ,    $0.00   ,"From USA Today Bestselling author, MJ Fields, comes a gripping story of love and its many truths.",,"[('Just Juls', 'Sometimes you discover that love has always been a part of your life. For as long as Ava can remember, Luke has been a part of her life. With families that have vacationed together, celebrated birthdays, and gone through tragedies that shaped the future – these two know just how vital the other is in their life. Nothing could shake the pedestal that Ava put Luke upon throughout the years. Until one fateful night by the pool changes everything……'), ('jhfreeborn', 'Taking things to the next level was always the plan where Ava was concerned. After all, patience had played a big part in holding on for the day that Luke would see Ava as more than just a friend. What transpired wasn’t what Ava had in mind, a no strings sexual relationship that had to be free of emotion. Years passed while the two met several times a year to give into their needs, but all of that changed the moment Ava confessed that this meant more than just a fling.'), ('Justirishgirl', 'Shattered from the cutting words that came from Luke, Ava turns to the one person that has tempted her to find love over the course of those seven years. Thomas is the complete opposite of Luke. The rugged rocker could have any female that lines up at his door, but that doesn’t keep him from wanting to make Ava the center of his universe. Determined to bring sunshine back into Ava’s life, Thomas opens the door to all the possibilities that he can offer a woman who clearly should have been worshipped all these years. Making Ava forget the past is easier said than done, but nothing will prepare the two for the journey that their lives will take from this point forward.')]"
  I can do It From Zero: planner book.A Daily Gratitude Journal for Kids.fitnss clandrie for your life and good body , $5.90 ,Ships from,979-8541913453,
  Priscilla Filet Crochet Book 1911: A Collection of Beautiful Designs in Filet Crochet , $3.99 ,"Priscilla Filet Crochet Book by Belle Robinson from the year 1911. 48 pages of a large collection of beautiful designs in filet crochet, equally adapted to cross stitch, beads and canvas with working directions. Some patterns and working models include pillows (baby, peacock, etc.), heart of flower, guest towels, flower doily, centerpiece, luncheon cloth, baby's bonnet, bedspread, hand bag, deer hunt, and many other designs especially of flowers, animals, and words.",,"[('Karen, NC', 'A great book. However it would be better in hard copy. These pattern grids are too difficult on a tablet or laptop.')]"
  6 x 9 Airplane Covered Notebook: 6 x 9 150 Page Airplane Covered Notebook , $7.75 ,Ships from,979-8761585409,
"  Six Great Dialogues: Apology, Crito, Phaedo, Phaedrus, Symposium, The Republic (Dover Thrift Editions: Philosophy) ", $6.99 ,Ships from,9780486454658,"[('Amazon Customer', ""It is common knowledge that Confucius, Socrates, Plato, Aristotle an a few others were great philosophers.  When we read that I.Q. scores have been rising, why doesn't common knowledge lead us to name the best professors of philosophy at the best universities of the modern world as being great and important to study?  This book has a clear, well structured text that can with some deep thought (often interfered with by multiple sources of noise and distractions) reveal why Plato was great and many highly educated philosophers seem to fall short.  The font used is a bit small and the margins too narrow but a real scholar reading this will be rewarded.""), ('Ben J Korgen', 'What a deal! The Republic and some of my favorite dialogs in a practically free book. Font is a teeny bit small but print is clear and readable, paper so-so, pages pushed close to the margin. Jowett translation was a standard for years and is fine. This is a no-brainer. Thank you, again, Dover. Wish this were available in a deluxe edition. Be sure to check out the other Dover editions that have a couple of dialogs each. Like this:\xa0'), ('BL', 'This is an intense book.  Needs one to spend the time to digest what is being said. That said, it amazes me how much the Greeks knew 2500 years back -- the good and evil were argued, though not always with rational logic, much like what happens today in DC!')]"
"  Homeschool Planner: Daily Assignment Tracker and Record Book.A Well Planned Year for Your Elementary, Middle School, Jr. High, or High School Student | Organization and Lesson Planner| ", $6.99 ,Ships from,979-8456580139,
  Lots of Knock Knock Jokes for Kids: Hilariously Corny Jokes for Kids and the Whole Family , $3.99 ,Ships from,979-8630651792,
  Address book with tabs: Amazing Flower Design Address JournalContact Notebook OrganizerAddress Log BookA-Z Alphabetical Tabs , $5.35 ,Ships from,978-1716279775,
"  3 IN 1 COLORING BOOK: FLOWER,ANIMAL,AND MANDLA Have Been Included in THIS BEAUTIFUL COLORING BOOK.A Coloring Book to Paint, Explore, and Discover ... featured in this mature and also kids color. ", $3.70 ,Ships from,979-8836412548,
  When You Hear Meow , $3.99 ,Excerpt from the book:,,"[('Judith', 'Alec the Cat and Ted-D Bear come to life in ""When You Hear Meow."" I especially enjoyed getting to know Ted-D, the younger brother of Alec. The two of them have many insights regarding the lives of their human parents, Don and Gloria. Through their eyes we share in the love of family and life\'s simple pleasures, and we also share poignant life events. My heart ached for little Ted-D in several sections of the book but I also sensed his happiness with his beloved family. Enjoy!'), ('William A. Schultz', ""The author is from Wisconsin and I give him credit for writing books.  It's an OK story that gets emotional at the end.  I think a better job of editing was needed.""), ('Cindy Rutherford', 'Such a sweet kind book. I smiled and cried with the characters. If you love cats, you will love this story. It will stay with me a long time.')]"
  Bird Watching Log Book: Bird Watching Journal and Log Book.A Gift for Watchers and Birders of Any to Record Sightings(Bird Journal For Bird Watching) , $5.99 ,Ships from,,
  Recipe Journal Book: My Favorite Recipes Book-A Book Collect the Recipes You Love in Your Own Custom Cookbook. , $5.90 ,Ships from,,
"  Christ Jesus Came Into The World To Save Sinners Sketch Book: ravel Size Framed Blank Page Art, Sketch and Doodle Book (CQS.0241) ", $8.99 ,Ships from,978-1096122753,
  My Spiritual Diary , $6.24 ,"This is an intimate, honest, humble accounting of one soul to its Creator. Writing in diary form, Dale Evans Rogers tells of the long, hard road from defeat to ultimate victory - a road she has known so well.",978-0800702151,"[('Amazon Customer', 'Was exactly what I expected, thank you great book!'), ('AJ Delagarza', 'VERY GOOD BOOK! FAST DELIVERY!  VERY SATISFIED!  THANKS!'), ('mary lou', ""I came across this book by accident and was delighted when I opened it and found that it had been written by Roy Roger's wife Dale Evans! It is a wonderful book of stories taken from their life and how spiritual quotations from the Bible applied to so many instances when they needed help as they traveled and performed. This is a really interesting collectible that should be treasured."")]"
  T.M.T.N: Kissing Cousins (Teaching Between Midnight & Dawn; A New Age...We Run this World... Book 2) ,    $0.00   ,Who Said Twins Were Just Alike...,,
"  Happy Easter Coloring Book for Kids: 52 Big & Easy Easter Coloring Book for Toddlers, Preschool Children, & Kindergarten, Include Bunny, Big Egg, Funny Animals & More ",Out of Print--Limited Availability.,"Spring is in the air and at this special time of year, children love to celebrate the wonder of Easter. This",979-8704578987,
  Halloween Activity Book for Kids ,Out of Print--Limited Availability.,Happy Halloween Coloring and Activity Book for Kids (New Children's Coloring Book for Halloween) - 50 ILLUSTRATIONS.,979-8484475179,
  Classic and American muscle cars : Adult coloring book: A Book of Cars - A Great Coloring Book for Adults and Teens who Love Cars ,Out of Print--Limited Availability.,"Classic Cars is an adult coloring book, but is great for any age",979-8770424515,
  Fishing journal for cool fishermen ,Out of Print--Limited Availability.,A fishing diary to keep track of your fishing trips.,979-8407060987,
"  Phone Call Log Book: Message Book With Over 550 Call Log Space, 4 Sets per Page ",Out of Print--Limited Availability.,What makes this logbook useful for you;,979-8804094004,
