Address,Price,Bed,Bath,Area,CarSpaces,Specification,Agent1Name,Agent1Number,Agent2Name,Agent2Number,PropertyId,Pictures,Url
"7 Ralton Avenue, Glen Waverley, Vic 3150","$3,500,000 - $3,800,000",5,4,736m²,2,"Dedicated to design excellence whilst delivering the highest level of luxury, this near new home indulges every aspect in life whilst promoting premium appointments, CBD views and prized placement in the Mount View Primary and Glen Waverley Secondary Zones (STSA). ,A celebration of quality craftsmanship, the home unfolds to reveal glamorous parquetry flooring that guides you through to a formal lounge room boasting designer lighting plus a Heat & Glo gas log fire. At the heart of the home, a double height void helps to filter light throughout, while the private theatre room comes equipped with a projector, screen and speakers and looks out towards the temperature controlled Visscool wine cellar. ,Beckoning gatherings with friends, the expansive kitchen, meals and family room is a culinary showpiece that embraces porcelain benches, Miele double ovens, Miele induction stove, integrated fridge/freezer, island breakfast bench plus a butler's kitchen boasting a Miele gas stove and Miele dishwasher. Offering a seamless transition for indoor-outdoor entertaining, glass doors with retractable flyscreens open onto an expansive entertainer's deck that's partially covered and accompanied by a synthetic turf backyard. ,Upstairs, a rumpus room provides a recreation sanctuary complete with a wet bar and accompanied by four of the five robed bedrooms including a guest bedroom with walk-in-robe and dual vanity ensuite, plus a lavish master suite with CBD views, deep balcony, dressing room and indulgent double shower ensuite. On the ground floor, the 5th bedroom benefits from a walk-in-robe and dual vanity ensuite, while the 4th bathroom rests upstairs and is supplemented by a ground floor powder room and fitted laundry with storage room and workbench. ,Finished to perfection with a 10kw solar panel system, Daikin 10 zone ducted heating/air conditioning unit, CCTV cameras, alarm, video intercom entry, keyless entry, double glazed windows, quality curtains and light switches plus a double garage with internal access and driveway gates. ,A masterpiece in every sense of the word, close to Mount View Primary, Glen Waverley Secondary, Caulfield Grammar, The Glen Shopping Centre, buses, Glen Waverley Station, Jells Park and freeways. ",Julie Wells,04088857...,Alice He,04344158...,144564724,"https://i2.au.reastatic.net/1136x696-resize,extend,r=33,g=40,b=46/3322916880d47ab6d3eb20aa8d089c79ae3f2b66d5f12760745d0b183f7370fc/image.jpg,https://i2.au.reastatic.net/1136x696-resize,extend,r=33,g=40,b=46/8a57f3ddd94ad78ca1b6062a7377de1bb8e40cafe7fb32f455927a11318c781f/image.jpg,https://i2.au.reastatic.net/1136x696-resize,extend,r=33,g=40,b=46/8a57f3ddd94ad78ca1b6062a7377de1bb8e40cafe7fb32f455927a11318c781f/image.jpg,https://i2.au.reastatic.net/1136x696-resize,extend,r=33,g=40,b=46/f9762c6291b8f0483f7daeb24deb725a2645b6c89515f3ee6a17f1328bf93dbd/image.jpg,https://i2.au.reastatic.net/1136x696-resize,extend,r=33,g=40,b=46/bd8c63045052bc94b1b552213eb363b473ded70a225901fdf9544ea576247f62/image.jpg",https://www.realestate.com.au/property-house-vic-glen+waverley-144564724
"3  Kirkwall Court, Glen Waverley, Vic 3150","$1,150,000 - $1,265,000",4,2,810m²,2,"This sweet vanilla brick veneer and its grand front verandah would have been a showpiece in its day. Now that proud history makes way for a promising future on an 810sqms (approx.) allotment along the park.,A superb top of the court position backing onto Brentwood Reserve puts you in walking distance to lovely green space, Code 5 café, Brentwood Secondary College and White Lanes Tennis Club, offering impressive access to the district’s lifestyle attributes.,The mid-century home presents in neat original condition, with updated central heating and cooling, s/s Fisher & Paykel dishwasher and bright living space and bedrooms – with a north-west facing aspect designed to capture morning and afternoon light.,For investors wanting to make plans to develop, the lease potential is high with REIV recording 4-bedroom median weekly rent at $698 in Glen Waverley.  ,Outside, the generous block invites vision for growth with potential to build a new family home or two town houses (STCA) in this family friendly pocket of Glen Waverley, just a short drive to The Glen’s shopping, dining and transport hub, esteemed Caulfield Grammar, M1 and Eastlink connections, and Monash Aquatic Centre and its 6 pools. ",Anna Du,04394179...,Perry Loong,04907943...,144676096,"https://i2.au.reastatic.net/1136x696-resize,extend,r=33,g=40,b=46/3f88ba5a709548242705b8eabb5981a1fdeb13f2b85ddfebf4b373aeb42acc32/image.jpg,https://i2.au.reastatic.net/1136x696-resize,extend,r=33,g=40,b=46/7189db97078c57df348d1c7083b731697922c74203e7e265290cb53bc6eebe3f/image.jpg,https://i2.au.reastatic.net/1136x696-resize,extend,r=33,g=40,b=46/7189db97078c57df348d1c7083b731697922c74203e7e265290cb53bc6eebe3f/image.jpg,https://i2.au.reastatic.net/1136x696-resize,extend,r=33,g=40,b=46/c627d1748d2e7fcb8f64f1e7a8b211630879519fe9e04e2a6ce3f61a87223c45/image.jpg,https://i2.au.reastatic.net/1136x696-resize,extend,r=33,g=40,b=46/45be50a4bd3bce4acfa45eb1357488df8437b84b4ea9131a8ca3693742a33203/image.jpg",https://www.realestate.com.au/property-house-vic-glen+waverley-144676096
"32 Clifford Street, Glen Waverley, Vic 3150","New Price $2,300,000 - $2,400,000",3,2,661m²,2,"Situated in a prime location and in arguably one of Glen Waverley's most sought-after streets, get ready to reap the rewards of this grand land and premier residential proposition on this 724m2 (approx.) allotment.,Combining this privileged position with premier potential, much-loved home offers the perfect live-in or rent-out opportunity for the family keen to build a palatial mansion in central Glen Waverley with Glen Waverley Secondary College only meters from your doorstep.,The choice is yours – ready to live in or lease out while you consider plans for the future – renovate, rebuild your dream home or redevelop two townhouses (STCA).,Enviably situated in the GWSC Zone, only a short walk from Wesley College, Glen Waverley Primary, The Glen with its recent renovations, Glen Waverley Train Station, the culinary delights of Kingsway, whilst within close proximity to both Monash and EastLink Freeways.,Disclaimer: We have in preparing this document used our best endeavours to ensure that the information contained in this document is true and accurate, but accept no responsibility and disclaim all liability in respect to any errors, omissions, inaccuracies or misstatements in this document. The fixtures, fittings, appliances and services have not been tested and no guarantee as to their functionality or efficiency can be provided. Distances and timings are approximate. Prospect purchasers should independently verify the information contained in this document and refer to the due diligence check-list provided by consumer affairs. Click on the link for a copy of the due diligence check-list: http://www.consumer.vic.gov.au/duediligencechecklist,    ",Andy Lou,04332916...,Belinda Leng,04321563...,142789908,"https://i2.au.reastatic.net/1136x696-resize,extend,r=33,g=40,b=46/9aa731cb9ea5749eba9ac5394e0ad0a9ae7f1bbebc597ab127927fdfab8aa412/image.jpg,https://i2.au.reastatic.net/1136x696-resize,extend,r=33,g=40,b=46/9aa731cb9ea5749eba9ac5394e0ad0a9ae7f1bbebc597ab127927fdfab8aa412/image.jpg,https://i2.au.reastatic.net/1136x696-resize,extend,r=33,g=40,b=46/e684898219824e775df5069b6aa60097a56a3ff37735a6d6705f595d67f08fab/image.jpg,https://i2.au.reastatic.net/1136x696-resize,extend,r=33,g=40,b=46/df19b910691fb5a22d8d6053361807cb56a62e454851aa9789829810f5b40309/image.jpg,https://i2.au.reastatic.net/1136x696-resize,extend,r=33,g=40,b=46/2d6874a60b9dd68282b1c0c6bc16efe62843042ce85ccaf646231294ad663da0/image.jpg",https://www.realestate.com.au/property-house-vic-glen+waverley-142789908
"16 Coolabah Avenue, Glen Waverley, Vic 3150",,3,2,658m²,2,"This much-loved home is in pristine condition and is immaculately presented.  Warm and inviting, this home is perfectly situated on a 658m2 block.  This allows an abundance of natural light through large picture windows into every room.  This property has been recently refurbished.  It has been freshly painted inside and out, has new plush pile carpets and new LED light fittings, all complemented by a complete roof restoration.  This well-appointed home has three bedrooms and another large multi-purpose room which could be your study, work from home space, third living area or a nursery.  The large private master bedroom has an ensuite and built-in mirrored wardrobes.,This home is an entertainer's delight, with a central custom-designed kitchen, fully appointed with Miele appliances and also features a combination microwave/second oven, and Corian benchtops.  Welcome your family and friends into the large formal lounge/dining area or the large family/meals area, both adjoining the kitchen.  Enjoy time on the expansive timber deck or under the shade of a mature Golden Elm tree which stands proud amongst a landscaped garden.  Relax in your large indoor Hot Spring Spa after work or unwind in front of your gas log fireplace.,This property is close to many sought after schools such as Glen Waverley South Primary, Brentwood Secondary College, Wesley College and Caulfield Grammar.  An easy walk takes you to Brandon Park Shopping Centre, while The Glen shopping centre, Glen Waverley station and Monash Aquatic and Recreation Centre are all nearby.,Simply move in and enjoy!,Expression of interest closing 16 April 2024 @ 4.00pm,Disclaimer:  Every precaution has been taken to establish the accuracy of the above information but it does not constitute any representation by the vendor/agent and agency.",Adrian Santini,04011996...,,,144564720,"https://i2.au.reastatic.net/1136x696-resize,extend,r=33,g=40,b=46/ab32e94a92a75f67235069227acd3b4d1d194e7cccfdc670bc63f1747a1e7798/image.jpg,https://i2.au.reastatic.net/1136x696-resize,extend,r=33,g=40,b=46/ab32e94a92a75f67235069227acd3b4d1d194e7cccfdc670bc63f1747a1e7798/image.jpg,https://i2.au.reastatic.net/1136x696-resize,extend,r=33,g=40,b=46/2823a34fb759c9660b4fa79b789f4ead0d10e6f48a86edb5479f928c00e40125/image.jpg,https://i2.au.reastatic.net/1136x696-resize,extend,r=33,g=40,b=46/1a8f53c38045e73a4d9640b253e83f5206975504cbe6227b02912b7748d766a1/image.jpg,https://i2.au.reastatic.net/1136x696-resize,extend,r=33,g=40,b=46/8913819c86a9748beb89da4d25f0ca16d224ce3d3172978049b4c45a3c7cb803/image.jpg",https://www.realestate.com.au/property-house-vic-glen+waverley-144564720
"91/42-60 Capital Avenue, Glen Waverley, Vic 3150","$530,000",1,1,,1,"Delight in this beautifully presented one-bedroom unit, boasting a modern refresh with new paint and floor coverings. The open-plan layout with a separate dining area opens to a charming private garden, perfect for relaxation.,Some of the key features of this unit include;,• Freshly updated interior,• Open-plan living with distinct dining area,• Private garden for tranquil outdoor living,• Lovely wooden deck for entertaining,• Kitchen with ample storage and bench space,• Convenient separate internal laundry,• Well-appointed bathroom with walk-in shower,• Split system heating/cooling for year-round comfort,• Ideal for low-maintenance lifestyle seekers,About Highvale Retirement Village by Keyton,Nestled close to Glen Waverley's scenic parklands and nearby shopping centres, Highvale Retirement Village offers a modern setting for your dream retirement lifestyle.,This sustainable, pet-friendly community boasts climate-conscious landscaping and communal vegetable gardens, ensuring a relaxing and enriching retirement lifestyle.,Whether you prefer a well-appointed villa or the added support of our serviced apartments, Highvale offers a range of living options to suit your preferences.,Immerse yourself in exceptional amenities and a vibrant calendar of social events set against a relaxed suburban backdrop.,Highvale Village amenities include;,• Pet-friendly village,• Community centre,• Gym facilities,• Village bus for shopping and outings,• Library and welcoming communal spaces,• Regular visits from hairdressers, barbers, and podiatrists,• Newspaper and chemist deliveries,• 24-hour emergency call system,Don’t miss this opportunity to make this home your own. Enquire today and book a tour.,*Photographs are for illustrative purposes. Some images may depict items not provided by Keyton within the units such as furniture and other decorative items.",Patrick Kelly,1800 550...,,,142149768,"https://i2.au.reastatic.net/1136x696-resize,extend,r=33,g=40,b=46/project/image.jpg,https://i2.au.reastatic.net/1136x696-resize,extend,r=33,g=40,b=46/2208e278ce76e690bbc379e04ef9f9e7094e2c6045ce050d2fbfbaccdbe9b1e7/image.jpg,https://i2.au.reastatic.net/1136x696-resize,extend,r=33,g=40,b=46/www.realestate.com.au/image.jpg,https://i2.au.reastatic.net/1136x696-resize,extend,r=33,g=40,b=46/listing/image.jpg,https://i2.au.reastatic.net/1136x696-resize,extend,r=33,g=40,b=46/agency/image.jpg",https://www.realestate.com.au/property-retirement+living-vic-glen+waverley-142149768
"1/107 Bogong Avenue, Glen Waverley, Vic 3150","$750,000 - $820,000",2,1,350m²,1,"Situated at the front of a small unit complex with its own separate driveway and garage this well-maintained light filled freestanding unit offers the perfect setting for first home buyers, downsizers or investors wishing to purchase in the elite Glen Waverley Secondary Catchment. ,Nestled within walking distance to Glen Waverley train station, Glen Shopping Centre, theatres, cafes and restaurants, the home's generous dimensions have been well-planned with the open plan living, dining and gally style kitchen with gas cooktop, under bench oven and dishwasher, bathroom with shower, bath, vanity, skylight and separate toilet, 2 robed bedrooms, delightful rear yard with decking area and gated access to the front of the property. ,Extra inclusions are external sunblinds, gas ducted heating, split system cooling and ceiling fans in the bedrooms. ,Photo ID required at all open for inspections.,Disclaimer: We have in preparing this document used our best endeavors to ensure that the information contained in this document is true and accurate, but accept no responsibility and disclaim all liability in respect to any errors, omissions, inaccuracies or misstatements in this document. Prospective purchasers should make their own enquiries to verify the information contained in this document. Purchasers should make their own enquires and refer to the due diligence check-list provided by Consumer Affairs. Click on the link for a copy of the due diligence check-list from Consumer Affairs. http://www.consumer.vic.gov.au/duediligencechecklist,    ",Sue Kelly-Brown,04183478...,Trisha Tan,04216670...,144291304,"https://i2.au.reastatic.net/1136x696-resize,extend,r=33,g=40,b=46/16303632b73643b16c64785b7afac0377bc654b008a4d15b5cdc7749d8b87fbb/image.jpg,https://i2.au.reastatic.net/1136x696-resize,extend,r=33,g=40,b=46/3cbc5a2c7390069b98aa2754d24a2a0af4cca3ae0f84e5fb5da1f2e1fb47dda5/image.jpg,https://i2.au.reastatic.net/1136x696-resize,extend,r=33,g=40,b=46/3cbc5a2c7390069b98aa2754d24a2a0af4cca3ae0f84e5fb5da1f2e1fb47dda5/image.jpg,https://i2.au.reastatic.net/1136x696-resize,extend,r=33,g=40,b=46/cd3a91dcf614f4fc323537eef29237158c1042f44986bf6cf73db777fa2a04dc/image.jpg,https://i2.au.reastatic.net/1136x696-resize,extend,r=33,g=40,b=46/56b446ef3f6d1541231e18f1f6fedefb2a8728e8d9a9092cd7b0772028cb6cbe/image.jpg",https://www.realestate.com.au/property-unit-vic-glen+waverley-144291304
"Cove Floorplan/42-60 Capital Avenue, Glen Waverley, Vic 3150","$90,000 - $120,000*",1,1,,1,"Feel at home in this welcoming and peaceful serviced apartment apartment floorplan with everything you need for a comfortable and stress-free living. Don’t miss this opportunity to live in one of our Cove apartments at Highvale.,Some of the key features of this Serviced Apartment floorplan include:,• a kitchenette,• a living/bedroom space with built-in closets, and a private bathroom,• enjoy different views, such as a balcony, a private courtyard, or a courtyard view depending on the location of the property you purchase.,About Highvale Retirement Village by Keyton,Nestled close to Glen Waverley's scenic parklands and nearby shopping centres, Highvale Retirement Village offers a modern setting for your dream retirement lifestyle. This sustainable, pet-friendly community boasts climate-conscious landscaping and communal vegetable gardens, ensuring a relaxing and enriching retirement lifestyle. Whether you prefer a well-appointed villa or the added support of our serviced apartments, Highvale offers a range of living options to suit your preferences.,Immerse yourself in exceptional amenities and a vibrant calendar of social events set against a relaxed suburban backdrop.,Highvale Village amenities include;,• Community centre,• Gym facilities,• Village bus for shopping and outings,• Library and welcoming communal spaces,• Regular visits from hairdressers and podiatrists,• Newspaper and chemist deliveries,• 24-hour emergency call system,--Next Steps--,We welcome you to book a village tour to learn more about the floorplans on offer and the lifestyle you could lead in Keyton’s Highvale Serviced Apartments. Book a tour with us today!,*Prices correct as of November 2023. *Photographs are for illustrative purposes. Some images may depict items not provided by Keyton within the units, such as furniture and other decorative items.",Courtney Di Gregorio,18005505...,,,143854160,"https://i2.au.reastatic.net/1136x696-resize,extend,r=33,g=40,b=46/project/image.jpg,https://i2.au.reastatic.net/1136x696-resize,extend,r=33,g=40,b=46/2208e278ce76e690bbc379e04ef9f9e7094e2c6045ce050d2fbfbaccdbe9b1e7/image.jpg,https://i2.au.reastatic.net/1136x696-resize,extend,r=33,g=40,b=46/www.realestate.com.au/image.jpg,https://i2.au.reastatic.net/1136x696-resize,extend,r=33,g=40,b=46/listing/image.jpg,https://i2.au.reastatic.net/1136x696-resize,extend,r=33,g=40,b=46/agency/image.jpg",https://www.realestate.com.au/property-serviced+apartment-vic-glen+waverley-143854160
"Grande Floorplan/42- Capital Avenue, Glen Waverley, Vic 3150","$335,000 - $360,000*",1,1,,1,"Welcome to a new way to have a placid and serene lifestyle in the compact and comfortable Grande floorplan. Don’t miss this opportunity to live in one of our Grande apartments at Highvale.,Some of the key features of this Serviced Apartment floorplan include:,• open plan style kitchenette and living area,• generous bedroom with a built-in or walk-in robe,• private and modern bathrooms,• some apartments also have a European style laundry for your convenience,• enjoy different views, such as a balcony, a private courtyard, or a courtyard view depending on the location of the property you purchase.,About Highvale Retirement Village by Keyton,Nestled close to Glen Waverley's scenic parklands and nearby shopping centres, Highvale Retirement Village offers a modern setting for your dream retirement lifestyle. This sustainable, pet-friendly community boasts climate-conscious landscaping and communal vegetable gardens, ensuring a relaxing and enriching retirement lifestyle. Whether you prefer a well-appointed villa or the added support of our serviced apartments, Highvale offers a range of living options to suit your preferences.,Immerse yourself in exceptional amenities and a vibrant calendar of social events set against a relaxed suburban backdrop.,Highvale Village amenities include;,• Community centre,• Gym facilities,• Village bus for shopping and outings,• Library and welcoming communal spaces,• Regular visits from hairdressers and podiatrists,• Newspaper and chemist deliveries,• 24-hour emergency call system,Next Steps,We welcome you to book a village tour to learn more about the floorplans on offer and the lifestyle you could lead in Keyton’s Highvale Serviced Apartments. Book a tour with us today!,*Prices correct as of November 2023. Photographs are for illustrative purposes. Some images may depict items not provided by Keyton within the units, such as furniture and other decorative items.",Courtney Di Gregorio,18005505...,,,143034020,"https://i2.au.reastatic.net/1136x696-resize,extend,r=33,g=40,b=46/project/image.jpg,https://i2.au.reastatic.net/1136x696-resize,extend,r=33,g=40,b=46/2208e278ce76e690bbc379e04ef9f9e7094e2c6045ce050d2fbfbaccdbe9b1e7/image.jpg,https://i2.au.reastatic.net/1136x696-resize,extend,r=33,g=40,b=46/www.realestate.com.au/image.jpg,https://i2.au.reastatic.net/1136x696-resize,extend,r=33,g=40,b=46/listing/image.jpg,https://i2.au.reastatic.net/1136x696-resize,extend,r=33,g=40,b=46/agency/image.jpg",https://www.realestate.com.au/property-serviced+apartment-vic-glen+waverley-143034020
"42-60 Capital Avenue, Glen Waverley, Vic 3150",,1,1,,1,,,,,,,"https://i2.au.reastatic.net/1136x696-resize,extend,r=33,g=40,b=46/89b21592ba688b01e226defe3f3ff38209c1fb83d7a3f7e2c6fd23d6dc88d4a9/image.jpg,https://i2.au.reastatic.net/1136x696-resize,extend,r=33,g=40,b=46/c83dc651381413164e962c1f25a8e69b2043e8ecb946ed89dde9afee1a8ac47b/image.jpg,https://i2.au.reastatic.net/1136x696-resize,extend,r=33,g=40,b=46/e98d1d11f46603b7001a2fe2b1d3ae3a0b4baaec7326c0fdebd8116fdd7b77ae/image.jpg,https://i2.au.reastatic.net/1136x696-resize,extend,r=33,g=40,b=46/2400251c827293560fb644e3fb3475f82e40e5d16296999cd05004b7fcc3f095/image.jpg,https://i2.au.reastatic.net/1136x696-resize,extend,r=33,g=40,b=46/6e362dff4911bb3375aed9db8e1dcd8c597288ccd6e8c6927e30c92d662cd34a/image.jpg",https://www.realestate.com.au/project/highvale-glen-waverley-600037524
"9 Settler Court, Glen Waverley, Vic 3150","$1,750,000 - $1,925,000",4,2,475m²,2,"Set in a spacious prestige private court just behind the Monash Aquatic Centre and Glen Waverley Tennis Club is this lovely home nestled in tranquil gardens. On entering you are greeted by the separate lounge on your left, with a dining room or convert to study 5th bedroom to your right, leading through to the open plan kitchen meals family area with its big windows taking in the gorgeous tranquil gardens and sun light. There has been new bathrooms and kitchen installed with caesarstone benchtops, induction hotplates and double oven, giving that modern feel. Upstairs there is an open family games area, full bathroom, a massive master bedroom with sitting area for quiet contemplation or reading your favourite book, along with three more good size bedrooms. You have the comfort of gas ducted heating, evaporative cooling upstairs, and remote door on the double garage. A lovely location for walks or bike rides along Scotchmans Creek Trail and Callaghan Reserve, or for the sports enthusiast the Central Reserve Sporting Grounds, tennis clubs and aquatic centre.",Darren Hill,04187877...,,,144292012,"https://i2.au.reastatic.net/1136x696-resize,extend,r=33,g=40,b=46/fe2e60368012fc72cef48b6498928400bfd0764148368876cb64ad76d932a3c6/image.jpg,https://i2.au.reastatic.net/1136x696-resize,extend,r=33,g=40,b=46/c5a897840d77dd976c805ee782bdd83d9fd6872ca09a14bfc672ea24e9137663/image.jpg,https://i2.au.reastatic.net/1136x696-resize,extend,r=33,g=40,b=46/bd1c75d2c5658bcb14ccda2d2e43056a9271715379f68388c66c4fdfb8ea836f/image.jpg,https://i2.au.reastatic.net/1136x696-resize,extend,r=33,g=40,b=46/632d980204efc80e9fae368af78d7d91d02cbd1d6d6c08ce0435e03e6c631d47/image.jpg,https://i2.au.reastatic.net/1136x696-resize,extend,r=33,g=40,b=46/9a5386596d22f85748af2f3bed59519be7f13936ded3e8098a4980ca9da6b451/image.jpg",https://www.realestate.com.au/property-house-vic-glen+waverley-144292012
