Address,Price,Bed,Bath,Area,CarSpaces,Specification,Agent1 Name,Agent1 Number,Agent2 Name,Agent2 Number,PropertyId,image_urls,Url
"Address available on request, Glen Waverley, Vic 3150","$4,600,000 - $4,960,000",5,5,745m²,2,"**FOR MORE INFORMATION PLEASE CONTACT ON KERRY HUANG: 0450 989 955**,**This property is open for inspection. In accordance to the Victorian Government guidelines, only fully vaccinated people will be able to attend the open for inspection/and auction for this property. Please ensure to scan the QR code at the property and present your proof of vaccination prior to entry.**,Majestically elevated and embracing magnificent Ranges views, this striking family home has been comprehensively renovated to deliver luxury and style in the dual school catchments of Glen Waverley Secondary and Mount View Primary School. ,Beyond the glass panelled front door, the home opens to reveal a sumptuous living room that's enriched with a picture window framing views and accompanied by a spacious study/home office with excellent walk-in storage. Rising upstairs, a spacious lounge and dining room awaits your entertainment enjoyment and offers the appeal of a fire place plus multiple doors that extend out onto the fabulous front balcony with breathtaking Ranges views. The modern kitchen boasts quality appliances and rests alongside a spacious meals zone, while a private family room spans out onto the northerly oriented entertaining deck with Bali hut and adjoining low-maintenance backyard. Carried over the two levels, there are five bedrooms, including a master bedroom with built-in-robe and ensuite, supplemented by two designer bathrooms each with a toilet plus a separate 4th toilet and full-sized laundry with workbench. Further enhanced by ducted heating, split system air conditioning, high ceilings plus excellent off-street parking. ,Placed in the prized GWSC and Mount View Primary Catchments, within walking distance to The Glen Shopping Centre and Glen Waverley Train Station, near Monash and EastLink Freeways.,*Photo ID and mask are required on inspection.,*Due to COVID regulation and attendees limitations, attendees must register prior to attendance.,COVID ADVICE:,*All inspection attendees are required to wear a mask or face covering. Our Agents reserve the right to deny access to attendees where Covid instructions have not been adhered to.*,With the well being of and health of our staff, residents, clients and contractors as our main priority it is our responsibility to advise of the following processes we are implementing in line with the State Government and WHO regulations to prevent the spread of Covid-19:,Should you be experiencing any of the following, we request that you do not enter the property and advise our Agents before scheduling an inspection:,Are showing any symptoms of illness/cold/flu,Have tested positive or been in contact with someone who has Covid-19,Have returned from travel overseas the last 14 days,Are currently under quarantine,We thank you for your attention and respecting the health and safety of our workplace.",Kerry Huang,0450989955,Joyce Liu,0466968829,139687243,"https://i2.au.reastatic.net/800x600-resize,extend,r=33,g=40,b=46/5f15b69e682e41d438bfb76834d6237b1a1d594cdad1f88512e10c69e73f6a74/image.jpg,https://i2.au.reastatic.net/800x600-resize,extend,r=33,g=40,b=46/5f15b69e682e41d438bfb76834d6237b1a1d594cdad1f88512e10c69e73f6a74/image.jpg,https://i2.au.reastatic.net/800x600-resize,extend,r=33,g=40,b=46/a37f0674653eafc8cf434913db986dbea36d8193bbb636b3ac2918fc0345379a/image.jpg,https://i2.au.reastatic.net/800x600-resize,extend,r=33,g=40,b=46/1823338fa6e3b42776b5b1acf906295c8567cc057b8d982e24afed2ca10f15a1/image.jpg",https://www.realestate.com.au/property-house-vic-glen+waverley-139687243
"31 Olinda Street, Glen Waverley, Vic 3150","$1,700,000 - $1,800,000",4,2,730m²,2,"Brilliantly positioned in one Glen Waverley’s most highly desired pockets, this comfortable 4 bedroom, 2 bathroom home delivers options for pursuing new home site plans (STCA), renovation or capitalizing on development potential for two 31/32sqm luxurious streetfront townhouses. Ideal for families seeking a move in ready or lease out opportunity, immaculate spaces provide an inviting lounge, kitchen, family/meals area with raked ceilings, ducted heating, split system AC, huge rear garden, tandem garage and ample off street parking. Zoned for Brentwood Secondary College, close to Glen Waverley South Primary, Brandon Park Shopping Centre, The Glen, Central Reserve, Glen Waverley train station, Wesley College and Freeway access.",Lily Chen,0403707888,Vincent Chang,0421030091,144231548,"https://i2.au.reastatic.net/800x600-resize,extend,r=33,g=40,b=46/187af9de37b8262ca2a99a2d9d7dc3e3bf3d52530739d463924ffc79b81d096c/image.jpg,https://i2.au.reastatic.net/800x600-resize,extend,r=33,g=40,b=46/ea5e3b04e2482bca21daa48fd13137daa6d456b70d8a2a54bfb5c808f1f4eaa4/image.jpg,https://i2.au.reastatic.net/800x600-resize,extend,r=33,g=40,b=46/ea5e3b04e2482bca21daa48fd13137daa6d456b70d8a2a54bfb5c808f1f4eaa4/image.jpg,https://i2.au.reastatic.net/800x600-resize,extend,r=33,g=40,b=46/184678577a3080748b929484092fd7e6ccb9dd45f73055e29515d4101d211b93/image.jpg,https://i2.au.reastatic.net/800x600-resize,extend,r=33,g=40,b=46/4e5eadb3557a38990abf652f7afc905b325df7cf995840b34cb2600ba5bdb99e/image.jpg",https://www.realestate.com.au/property-house-vic-glen+waverley-144231548
"23 Diamond Avenue, Glen Waverley, Vic 3150","$1,580,000 - $1,650,000",4,2,663m²,2,"Open for inspection at 10:00am - 10:30am This Saturday & Sunday 20& 21 April,* Within Glen Waverley Primary School & Highvale Secondary College Catchment Zone (STSA),* Frontage: appx.18 metre wide x 37metre depth,Set on a regular block of approx. 663m2 in central Glen Waverley & perfectly positioned within walking distance to Glen Waverley Primary School & Highvale Secondary College and The New Glen Shopping Centre just up the road, this well kept family home was renovated with a family focused floorplan & quality family lifestyle in mind.,• Quiet family friendly location within walking distance to local primary and secondary schools including Highvale Secondary College, Glen Waverley Primary & Highvale Primary School,• Offering exceptional living spaces, with a family friendly floor plan with formal lounge room, separate dining ,• Four sizable bedrooms including 3 with BIRs plus a home office or study and 2 modern bathrooms with a dual basin vanity & skylight,• Sparkling modern kitchen equipped with quality appliances, extensive Caesarstone benchtops & abundant storage space;,• A covered pergola is overlooking outdoor gardens, double lock up garage, garden shed + wide driveway offering more parking space;,• Gas ducted heating throughout, polished Tassie Oak hardwood floorboards plus split-system air conditioning; ,• Update the original home or re-develop a brand new luxury home with breath-taking views of The Dandenong Ranges, the option is in your hands (STSA),• Super conveniently located within close proximity to all desired amenities and services,Conveniently located in a highly sought-after neighbourhood, within the Highvale Secondary College catchment and walking distance to Glen Waverley Primary school and near a short stroll to The Glen Shopping Centre and Kingsway Dining Strip, Bushy Park Wetlands, Jells Park, reserves and public transport easy access to Glen Waverley train station & EastLink motorway, this family home is sure to be impressive.,Contact Jerry Zhu 0401 753 099 for more information.,PHOTO ID REQUIRED AT ALL OPEN FOR INSPECTIONS,INSPECTION TIMES are subject to change without notice,Disclaimer: We have in preparing this document used our best endeavours to ensure that the information contained in this document is true and accurate, but accept no responsibility and disclaim all liability in respect to any errors, omissions, inaccuracies or misstatements in this document. Prospect purchasers should make their own enquiries to verify the information contained in this document and refer to the due diligence check-list provided by consumer affairs. Click on the link for a copy of the due diligence check-list: http://www.consumer.vic.gov.au/duediligencechecklist",Jerry Zhu,0401753099,Francis Leung,0398875111,144378892,"https://i2.au.reastatic.net/800x600-resize,extend,r=33,g=40,b=46/56b6393914cafd2a65c6ede81068b6ababbbbfe81dbe067a906e196d7d7c0cc3/image.jpg,https://i2.au.reastatic.net/800x600-resize,extend,r=33,g=40,b=46/75c0ef38025cf97e65711ac71e9b86874ca3d191a42c9fdf9fb6ccf19943ba67/image.jpg,https://i2.au.reastatic.net/800x600-resize,extend,r=33,g=40,b=46/75c0ef38025cf97e65711ac71e9b86874ca3d191a42c9fdf9fb6ccf19943ba67/image.jpg,https://i2.au.reastatic.net/800x600-resize,extend,r=33,g=40,b=46/dad4eb030b9c5657263465bd1cd5b2eef5861304abc62712afee2cddc3a53d76/image.jpg,https://i2.au.reastatic.net/800x600-resize,extend,r=33,g=40,b=46/d2d538e9a01a6b5a613df803b45558b6ec70bb86c706d69b22052cb4b3cb6e1c/image.jpg",https://www.realestate.com.au/property-house-vic-glen+waverley-144378892
"27 Kennedy Street, Glen Waverley, Vic 3150","$2,600,000 - $2,650,000",3,1,727m²,1,"Located in a remarkable area with unlimited potential, this rectangular allotment boasts an expansive frontage of around 17.7 meters and spans approximately 727 square meters. Offering breathtaking views of the mountains, this block features north-facing backyards, making it an ideal spot for building your dream home. Alternatively, this prime location within the highly sought-after Glen Waverley Secondary School Zone (STSA) offers a great opportunity for smart investors, builders, and developers to leave their mark.,This property is situated on one of the most convenient streets in Glen Waverley, providing easy access to various amenities such as The Glen Shopping Centre, Glen Waverley Secondary, Glen Waverley Primary, Glen Waverley Train Station, Kingsway restaurants, as well as the Monash and EastLink Freeways.",Qiao Tang,0425719979,,,141746368,"https://i2.au.reastatic.net/800x600-resize,extend,r=33,g=40,b=46/3737f14f1bf1fb814627e045b4f562199461dac0d78ff98cb77d7d2fa98c832b/image.jpg,https://i2.au.reastatic.net/800x600-resize,extend,r=33,g=40,b=46/b82d72a77a12329c86ae7b5565780dec319bc0b13a55f7799f04f00ffe0a8948/image.jpg,https://i2.au.reastatic.net/800x600-resize,extend,r=33,g=40,b=46/b82d72a77a12329c86ae7b5565780dec319bc0b13a55f7799f04f00ffe0a8948/image.jpg,https://i2.au.reastatic.net/800x600-resize,extend,r=33,g=40,b=46/81387ca75bb69d06cb09859a80a0c3cdea59fe1ef00ae23737afe45234740288/image.jpg,https://i2.au.reastatic.net/800x600-resize,extend,r=33,g=40,b=46/2f59b430a89e987c9628713e379f1420c6d0eb01e6ede5ad61e9ef531d8022d4/image.jpg",https://www.realestate.com.au/property-house-vic-glen+waverley-141746368
"104 Springvale Road, Glen Waverley, Vic 3150","SOLD - $981,000",3,1,359m²,2,"Presenting first homebuyers and investors with an increasingly rare opportunity to get a foothold in the property market, this home enjoys a stylish carefree design only a short walk from The Glen Shopping Centre. ,Accessed via the service road with a secure portico entry, the home's flowing design takes you through to a light-filled lounge and dining room that's been updated with modern flooring for a fashionable feel. ,The adjacent kitchen is neatly presented and boasts a Blanco stove, Blanco oven, stainless steel dishwasher, glass splashbacks and double sinks, while sliding doors entice you out onto the entertaining zone with Dandenong Ranges views. ,Whether you're just starting out or accommodating a family, you'll appreciate the inclusion of three bedrooms, accompanied by a family bathroom, separate toilet and laundry. ,Well-appointed with ducted heating, air conditioning, alarm, fresh paintwork, garden shed, single garage plus driveway parking. ,Zoned to Highvale Secondary College (STSA), walking distance to Highvale Primary, The Glen Shopping Centre, buses, Glen Waverley Station and reserves with central access to Monash Freeway, EastLink and the Eastern Freeway. ,Photo ID required at all open for inspections.",Steven Zhang,0450365000,Jourdain Creigh,0430012267,144510436,"https://i2.au.reastatic.net/800x600-resize,extend,r=33,g=40,b=46/ce63c10bfd0fcdc16565c951d922fd722ac878627041f04ca1a26f08c243c1bc/image.jpg,https://i2.au.reastatic.net/800x600-resize,extend,r=33,g=40,b=46/9772eaf3e211f562738e2715b98441e0011fc1e9715298e4c67e2dad2662e38e/image.jpg,https://i2.au.reastatic.net/800x600-resize,extend,r=33,g=40,b=46/9772eaf3e211f562738e2715b98441e0011fc1e9715298e4c67e2dad2662e38e/image.jpg,https://i2.au.reastatic.net/800x600-resize,extend,r=33,g=40,b=46/bccb3ca4f47a68c4ec1e889da5424e4de8bd269eee48b99a13192d9b03e40dcb/image.jpg,https://i2.au.reastatic.net/800x600-resize,extend,r=33,g=40,b=46/b74881f45594ad84f1b644f9003786b1905524ea9df8f0815e742abae34ac139/image.jpg",https://www.realestate.com.au/property-house-vic-glen+waverley-144510436
"Type B6/583 Ferntree Gully Road, Glen Waverley, Vic 3150","$1,565,000",4,3,207m²,2,"•	A lovely east/west orientated double storey townhome with north facing windows,•	Well defined layout with individual dining and living space that opens to a balcony ,•	A multi-purpose room on the ground floor provides flexibility to be used as a study or home office.,•	A powder room and laundry are positioned on the ground floor,•	Double garage,•	Generous storage throughout including a storage shed in the back courtyard. ,•	Suitable for those looking to upsize or for maturing families that require additional space,Floret is a vibrant new community of premium townhouses located in Glen Waverley, available from $1.26M.,With elevated interiors designed by award-winning architects RotheLowman and verdant landscapes by renowned ASPECT Studios, our Floret Townhouses share a rich synergy between built and natural environments.,Supporting the needs of a modern lifestyle, Floret boasts proximity to vast retail offerings, eminent public and private schools, universities and expansive green spaces.,Display suite is open by appointment.,583 Ferntree Gully Road, Glen Waverley  ,FloretHomes.com.au",Sherroy Ong,0423426018,Shin Fu,03,140791835,"https://i2.au.reastatic.net/800x600-resize,extend,r=33,g=40,b=46/af524ebab1a41772c7058e9325cef9de961df2206608909dfa7d4d9083470638/image.jpg,https://i2.au.reastatic.net/800x600-resize,extend,r=33,g=40,b=46/be06e81310482d26f1b67e0df1d26bcff01da18e73e38ea042b62f7e8f1690bd/image.jpg,https://i2.au.reastatic.net/800x600-resize,extend,r=33,g=40,b=46/2898a5368c0b1696f85c6d927051f34eff645a76898a755d2707d2c52f5193a6/image.jpg,https://i2.au.reastatic.net/800x600-resize,extend,r=33,g=40,b=46/ebc9edfb10fa85909e1ef3266ba12501ccff0d8d2539238785db48c80214c867/image.jpg,https://i2.au.reastatic.net/800x600-resize,extend,r=33,g=40,b=46/6d89ab59f43f2e1eea079540f45d9a8ba8992b3dd7fbb1cc5c50562ec109fa87/image.jpg",https://www.realestate.com.au/property-townhouse-vic-glen+waverley-140791835
"Type B4A/583 Ferntree Gully Road, Glen Waverley, Vic 3150","$1,475,000",4,3,207m²,2,"•	Three level, three bedrooms with an additional flexi room townhome provides generous living space with large glass doors that open to an entertainer’s backyard. ,•	This townhome is one of the larger residences in the estate. ,•	Spacious master bedroom with WIR ,•	Three additional upstairs bedrooms with a large family bathroom,•	Separate laundry room,•	Double garage,•	Abundant amount of storage and cupboards throughout including a outdoor shed,•	Large, landscaped backyard with paved courtyard,•	Suited for downsizers, upsizers or maturing families.,Floret is a vibrant new community of premium townhouses located in Glen Waverley, available from $126M.,With elevated interiors designed by award-winning architects RotheLowman and verdant landscapes by renowned ASPECT Studios, our Floret Townhouses share a rich synergy between built and natural environments.,Supporting the needs of a modern lifestyle, Floret boasts proximity to vast retail offerings, eminent public and private schools, universities and expansive green spaces.,Display suite is open by appointment.,583 Ferntree Gully Road, Glen Waverley  ,FloretHomes.com.au",Shin Fu,03,Sherroy Ong,90179250,140791955,"https://i2.au.reastatic.net/800x600-resize,extend,r=33,g=40,b=46/af524ebab1a41772c7058e9325cef9de961df2206608909dfa7d4d9083470638/image.jpg,https://i2.au.reastatic.net/800x600-resize,extend,r=33,g=40,b=46/be06e81310482d26f1b67e0df1d26bcff01da18e73e38ea042b62f7e8f1690bd/image.jpg,https://i2.au.reastatic.net/800x600-resize,extend,r=33,g=40,b=46/2898a5368c0b1696f85c6d927051f34eff645a76898a755d2707d2c52f5193a6/image.jpg,https://i2.au.reastatic.net/800x600-resize,extend,r=33,g=40,b=46/ebc9edfb10fa85909e1ef3266ba12501ccff0d8d2539238785db48c80214c867/image.jpg,https://i2.au.reastatic.net/800x600-resize,extend,r=33,g=40,b=46/6d89ab59f43f2e1eea079540f45d9a8ba8992b3dd7fbb1cc5c50562ec109fa87/image.jpg",https://www.realestate.com.au/property-townhouse-vic-glen+waverley-140791955
"Type C1/583 Ferntree Gully Road, Glen Waverley, Vic 3150","$1,260,000",4,3,207m²,2,"•	Three level townhome providing a generous 4-bedroom layout for flexible living. ,•	Spacious light filled master bedroom with generous robe and en suite.  ,•	Study nook in second bedroom on second floor  ,•	A ground floor bedroom with a bathroom opposite provides the opportunity for multi-generational family living or the added flexibility to work from home.  ,•	Rear entry two car garage allows for additional storage,•	Drying courtyard off the garage,•	Suitable for young families or upsizers who are looking for more space and flexibility, perfect investment opportunity in the centre of Glen Waverley.,Floret is a vibrant new community of premium townhouses located in Glen Waverley, available from $$1.26M.,With elevated interiors designed by award-winning architects RotheLowman and verdant landscapes by renowned ASPECT Studios, our Floret Townhouses share a rich synergy between built and natural environments.,Supporting the needs of a modern lifestyle, Floret boasts proximity to vast retail offerings, eminent public and private schools, universities and expansive green spaces.,Display suite is open by appointment.,583 Ferntree Gully Road, Glen Waverley  ,FloretHomes.com.au",Silvia Pan,0456250228,Sherroy Ong,0423426018,140791435,"https://i2.au.reastatic.net/800x600-resize,extend,r=33,g=40,b=46/af524ebab1a41772c7058e9325cef9de961df2206608909dfa7d4d9083470638/image.jpg,https://i2.au.reastatic.net/800x600-resize,extend,r=33,g=40,b=46/be06e81310482d26f1b67e0df1d26bcff01da18e73e38ea042b62f7e8f1690bd/image.jpg,https://i2.au.reastatic.net/800x600-resize,extend,r=33,g=40,b=46/2898a5368c0b1696f85c6d927051f34eff645a76898a755d2707d2c52f5193a6/image.jpg,https://i2.au.reastatic.net/800x600-resize,extend,r=33,g=40,b=46/ebc9edfb10fa85909e1ef3266ba12501ccff0d8d2539238785db48c80214c867/image.jpg,https://i2.au.reastatic.net/800x600-resize,extend,r=33,g=40,b=46/6d89ab59f43f2e1eea079540f45d9a8ba8992b3dd7fbb1cc5c50562ec109fa87/image.jpg",https://www.realestate.com.au/property-townhouse-vic-glen+waverley-140791435
"TYPE A3/583 Ferntree Gully Rd, Glen Waverley, Vic 3150","$1,395,000",3,3,226m²,2,"• Three level townhome providing a generous spacious layout for flexible living.,• A beautiful walk-in wardrobe in the second bedroom ,• A ground floor second living with a bathroom next to it provides the opportunity for multi-purpose family entertainment or the added flexibility to work from home.,• Drying courtyard off the garage,• Suitable for first home buyer, young families, downsizers or upsizers who are looking for more space and flexibility, perfect investment opportunity in the centre of Glen Waverley.,Floret is a vibrant new community of premium townhouses located in Glen Waverley, available from $995k.,With elevated interiors designed by award-winning architects RotheLowman and verdant landscapes by renowned ASPECT Studios, our Floret Townhouses share a rich synergy between built and natural environments.,Supporting the needs of a modern lifestyle, Floret boasts proximity to vast retail offerings, eminent public and private schools, universities and expansive green spaces.,Display suite is open by appointment. Please contact our sales team to book inspection.,Display Address: 583 Ferntree Gully Road, Glen Waverley,FloretHomes.com.au",Silvia Pan,0456250228,Sherroy Ong,0423426018,143721120,"https://i2.au.reastatic.net/800x600-resize,extend,r=33,g=40,b=46/af524ebab1a41772c7058e9325cef9de961df2206608909dfa7d4d9083470638/image.jpg,https://i2.au.reastatic.net/800x600-resize,extend,r=33,g=40,b=46/be06e81310482d26f1b67e0df1d26bcff01da18e73e38ea042b62f7e8f1690bd/image.jpg,https://i2.au.reastatic.net/800x600-resize,extend,r=33,g=40,b=46/2898a5368c0b1696f85c6d927051f34eff645a76898a755d2707d2c52f5193a6/image.jpg,https://i2.au.reastatic.net/800x600-resize,extend,r=33,g=40,b=46/ebc9edfb10fa85909e1ef3266ba12501ccff0d8d2539238785db48c80214c867/image.jpg,https://i2.au.reastatic.net/800x600-resize,extend,r=33,g=40,b=46/6d89ab59f43f2e1eea079540f45d9a8ba8992b3dd7fbb1cc5c50562ec109fa87/image.jpg",https://www.realestate.com.au/property-townhouse-vic-glen+waverley-143721120
"2/99 Bogong Avenue, Glen Waverley, Vic 3150","$1,200,000 - $1,300,000",3,2,312m²,2,"Seamlessly mixing its modern style with the ultimate in comfort and convenience, this spacious townhouse ensures entertaining is effortless whilst embracing dual living zones in the elite Glen Waverley Secondary Zone (STSA). ,Resting at the rear of only two, the home's expansive design delights upon entry with sleek floorboards guiding you into the sun kissed formal lounge room where you can chat with guests during the winter months. ,A magnificent kitchen, dining and family room provides the perfect setting for everyday enjoyment and encompasses waterfall stone benches and splashbacks, gas stove, Euromaid oven, Dishlex dishwasher plus a breakfast bench. ,Flanking this space are sliding doors that span out onto a low-maintenance courtyard on one side and a generous entertaining deck on the other side with discreet gated access to the rear walking trail. ,Enjoying ground floor placement, the master bedroom comes equipped with a walk-in-robe and ensuite, supplemented on this level by a separate guest toilet and laundry. A central staircase takes you upstairs, here to two remaining bedrooms both feature built-in-robes and floorboards and are served by a bathroom with toilet. ,Curated for easy living and complemented by the inclusions of ducted heating, keyless entry, LED downlights, high ceilings, under stair storage, garden shed plus a double garage with internal access. ,Walking distance to central Glen Waverley where you can access trains and The Glen Shopping Centre, near Syndal South Primary, Glen Waverley Secondary, Wesley College, Kingsway restaurants, Bogong Reserve, Monash Aquatic Centre and freeways. ",Anita Meng,0410000898,Nuria Jewell,0450000898,144519536,"https://i2.au.reastatic.net/800x600-resize,extend,r=33,g=40,b=46/ce63c10bfd0fcdc16565c951d922fd722ac878627041f04ca1a26f08c243c1bc/image.jpg,https://i2.au.reastatic.net/800x600-resize,extend,r=33,g=40,b=46/836b57f23945bdaafa480b42a95809c446b0414393e0b5689e1af67aa1fceff0/image.jpg,https://i2.au.reastatic.net/800x600-resize,extend,r=33,g=40,b=46/836b57f23945bdaafa480b42a95809c446b0414393e0b5689e1af67aa1fceff0/image.jpg,https://i2.au.reastatic.net/800x600-resize,extend,r=33,g=40,b=46/d3ffc525e8a412867a946b2c32c3b396c44855b60ded3afe3004246b3c80fdb0/image.jpg,https://i2.au.reastatic.net/800x600-resize,extend,r=33,g=40,b=46/47dd508c2da13a1ae27e9ec58abb939f5765f19d4660a073bca54cbeeecffb20/image.jpg",https://www.realestate.com.au/property-townhouse-vic-glen+waverley-144519536
