Address,Price,Bed,Bath,Area,CarSpaces,Specification,Agent1 Name,Agent1 Number,Agent2 Name,Agent2 Number,PropertyId,image_urls,Url
"2/127 View Mount Road, Glen Waverley, Vic 3150","$1,380,000 - $1,480,000",4,2,457m²,2,"Setting a new benchmark in luxurious lifestyle design, this brand-new residence sits peacefully at the rear of two and is perfected by premium appointments and a family-friendly floorplan in the Brentwood Secondary Zone (STSA). ,Every aspect of this home exudes excellence with the westerly oriented living and dining zone bathed in afternoon sunshine and embracing the allure of high ceilings and stylish flooring. ,Attached to this space is a magnificent kitchen that's certain to impress guests with its waterfall stone benches, 900mm Smeg oven/gas stove, Smeg dishwasher, soft close cabinetry, island breakfast bench and 2nd kitchen equipped with its own Smeg gas stove. ,The effortless flow between inside and out is achieved with sliding doors opening from the open plan domain onto a fabulous entertainer's deck and landscaped courtyard. ,Upstairs, a carpeted retreat adds to the comfort of the home and accompanies three of the four robed bedrooms, including one with direct ensuite effect access to the family bathroom that reflects designer style. ,On the ground floor, the master bedroom is spacious and flaunts comforting carpet, a fitted walk-in-robe and dual vanity ensuite, additionally served by a powder room and laundry boasting a stone bench and storage cupboards. ,Superbly appointed with split system heating/air conditioning, alarm, CCTV camera, high ceilings, water tank, garden shed, Colorbond fences plus a double garage with internal access. ,Conveniently nestled within walking distance to Wheelers Hill Primary, Glen Waverley South Primary, Brentwood Secondary, Brandon Park Shopping Centre, buses and Brentwood Reserve, near Jells Park, Caulfield Grammar and Monash Freeway., ",Jack Qi,0451978567,Julie Wells,0408885718,144758548,"https://i2.au.reastatic.net/800x600-resize,extend,r=33,g=40,b=46/ce63c10bfd0fcdc16565c951d922fd722ac878627041f04ca1a26f08c243c1bc/image.jpg,https://i2.au.reastatic.net/800x600-resize,extend,r=33,g=40,b=46/9d2f34c62e8ee6f67e56b72fdc13c975672faf1b0e69893a4c5fe456d73d97ef/image.jpg,https://i2.au.reastatic.net/800x600-resize,extend,r=33,g=40,b=46/9d2f34c62e8ee6f67e56b72fdc13c975672faf1b0e69893a4c5fe456d73d97ef/image.jpg,https://i2.au.reastatic.net/800x600-resize,extend,r=33,g=40,b=46/742cc37d8ee5c3c30de7395a13f2c8593909e63d2f252316690fbd5bbdf580c7/image.jpg,https://i2.au.reastatic.net/800x600-resize,extend,r=33,g=40,b=46/1d5ee60114190d19df25fa4192a06a7b990b4d3aa5edabbd633ac7f8d5a8430d/image.jpg",https://www.realestate.com.au/property-townhouse-vic-glen+waverley-144758548
"2 Kerferd Road, Glen Waverley, Vic 3150","$1,400,000 - $1,500,000",5,2,808m²,2,"Instantly appealing for its stylishly renovated interiors, warm ambience and generous outdoor dimensions (808sqm approx), this inviting home is ready for immediate family enjoyment with plenty of space and potential to redevelop in the future if desired (STCA). Platinum presentation and timber floors welcome a light-filled living/dining domain, accompanied by a well-appointed stone kitchen and huge family room. 4 robed bedrooms are conveniently placed on both levels and serviced by 2 stunning bathrooms, while ducted heating, split system AC, under stair storage, study/5th bedroom huge backyard, double garage and off street parking add further comfort. Enjoy as is, or seize the reins and shape your future to build a luxurious new home or multiple townhouses (STCA), minutes to Brentwood Secondary College, Glen Waverley South Primary, Monash Uni, Brandon Park Shopping Centre, The Glen, public transport and Monash/EastLink Freeways.",Tori Liu,0430479889,Calvin Huang,0433625756,144579744,"https://i2.au.reastatic.net/800x600-resize,extend,r=33,g=40,b=46/187af9de37b8262ca2a99a2d9d7dc3e3bf3d52530739d463924ffc79b81d096c/image.jpg,https://i2.au.reastatic.net/800x600-resize,extend,r=33,g=40,b=46/3ff881a110206c08e43805769e30f90a66ca42a0611bc5e2528e705033e37e7c/image.jpg,https://i2.au.reastatic.net/800x600-resize,extend,r=33,g=40,b=46/3ff881a110206c08e43805769e30f90a66ca42a0611bc5e2528e705033e37e7c/image.jpg,https://i2.au.reastatic.net/800x600-resize,extend,r=33,g=40,b=46/ef4406001f4523970295605bfc212b09ee4aeec74457023fe1c272dedc90c78a/image.jpg,https://i2.au.reastatic.net/800x600-resize,extend,r=33,g=40,b=46/d4808fb248cf0d180bc2ff50b9af5dce977046bc00b0ec289b8479b4521ad537/image.jpg",https://www.realestate.com.au/property-house-vic-glen+waverley-144579744
"857 Waverley Road, Glen Waverley, Vic 3150","$1,400,000 - $1,500,000",3,2,704m²,2,"Deceptively spacious and centered around open plan enjoyment, this single level home spans an impressive 659sqm approx. allotment and offers comfort for the family in the Mount View Primary and Brentwood Secondary Zones.,Only moments from local shops and Jells Park, the home’s design delivers flexibility with the formal lounge room providing space to create a 4th bedroom, while the kitchen, dining and family room offers plenty of space to relax.,Property Highlights:,•	Three oversized bedrooms, all with robes including the master bedroom that boasts a walk-in-robe and ensuite,•	Neatly presented family bathroom with separate toilet,•	Massive bedroom-sized laundry with storage and workbench,•	Generous formal lounge room/potential 4th bedroom,•	Kitchen complemented by a privacy ledge and featuring a gas stove, Bosch oven and Asko dishwasher,•	Open plan dining and family room embracing polished floorboards plus a combustion fireplace,•	Alfresco zone capturing afternoon sunshine and spanning out to the backyard,•	Enriched with ducted heating and split system air conditioning for comfort,•	Further benefitting from an alarm, storage shed and double garage,Local Attractions:,•	Zoned to Mount View Primary and Brentwood Secondary,•	Meters from local shops, buses and Jells Park,•	Close to Caulfield Grammar, The Glen Shopping Centre and Glen Waverley Station,•	Convenient access to EastLink and the Monash Freeway",Jessica Chea,0395603988,,,144269496,"https://i2.au.reastatic.net/800x600-resize,extend,r=33,g=40,b=46/5be8562c6334b993d2715f7f7c8127368202d9cc669560009f7f9befdfaf8a87/image.jpg,https://i2.au.reastatic.net/800x600-resize,extend,r=33,g=40,b=46/2aaab8f7825c98b546d1092ba979f7c03bcbaeed9e6000ac9a4a9098817b7999/image.jpg,https://i2.au.reastatic.net/800x600-resize,extend,r=33,g=40,b=46/2aaab8f7825c98b546d1092ba979f7c03bcbaeed9e6000ac9a4a9098817b7999/image.jpg,https://i2.au.reastatic.net/800x600-resize,extend,r=33,g=40,b=46/076d4ab86f4876ce39c10d8f7173488f6b937149c75feb3b061fb84735683945/image.jpg,https://i2.au.reastatic.net/800x600-resize,extend,r=33,g=40,b=46/180b0c4e724fcc4565bc41f545be4338b084ca390e0a804cc73c20464eb763cf/image.jpg",https://www.realestate.com.au/property-house-vic-glen+waverley-144269496
"1/594 Waverley Road, Glen Waverley, Vic 3150","$860,000-$960,000",4,2,331m²,2,"A stunning lifestyle creation, this sleekly styled townhouse serves to impress executives, families and investors with its streamlined indoor-outdoor ambience and superb placement in the coveted dual school zones of Pinewood Primary and Glen Waverley Secondary (STSA). ,-Three robed bedrooms plus study (or fourth bedroom ) including an upstairs master bedroom with walk-in-robe and ensuite ,-Stylish main bathroom with floor-to-ceiling tiles and the convenience of a toilet along with a separate laundry ,-Quality equipped kitchen showcasing stone benches, stainless steel oven/gas stove, dishwasher plus a breakfast bench ,-Open plan living and dining zone adorned with fashionable flooring ,-Sliding doors linking the living room with the alfresco entertaining zone with fuss-free courtyard.,-Split system heating/air conditioning both upstairs and down, water tank plus a garden shed ,-Double garage for secure vehicle parking,Centrally situated to ensure a life of convenience, with easy access to Pinewood Primary, Glen Waverley Secondary, Monash Uni, Pinewood shopping village, The Glen, buses, train stations, Monash Aquatic Centre, parkland, Waverley Private Hospital and Monash Freeway.,Photo ID required at all open for inspections.,Disclaimer: We have in preparing this document used our best endeavors to ensure that the information contained in this document is true and accurate, but accept no responsibility and disclaim all liability in respect to any errors, omissions, inaccuracies or misstatements in this document. Prospective purchasers should make their own enquiries to verify the information contained in this document. Purchasers should make their own enquires and refer to the due diligence check-list provided by Consumer Affairs. Click on the link for a copy of the due diligence check-list from Consumer Affairs. http://www.consumer.vic.gov.au/duediligencechecklist,    ",Eddie Fu,0421339638,Bryson Shen,0430282166,144765204,"https://i2.au.reastatic.net/800x600-resize,extend,r=33,g=40,b=46/9ced91c73246fcc4a90148aab22e67e9205b3f4c817891f1dfc28cf89ee63571/image.jpg,https://i2.au.reastatic.net/800x600-resize,extend,r=33,g=40,b=46/4ee9892753477314ebb6fbadf24995e9b6675c092c851e7ac10cbc1c27612f57/image.jpg,https://i2.au.reastatic.net/800x600-resize,extend,r=33,g=40,b=46/4ee9892753477314ebb6fbadf24995e9b6675c092c851e7ac10cbc1c27612f57/image.jpg,https://i2.au.reastatic.net/800x600-resize,extend,r=33,g=40,b=46/5b1b5fc06bf4a59e2ee2960891cd10679eeeed28f032d2ed2b051f1c4f875050/image.jpg,https://i2.au.reastatic.net/800x600-resize,extend,r=33,g=40,b=46/7a231f2db5f74c124f5ec5d0754188e4772fb1ac7d16b84be0fa34f0f9ad4873/image.jpg",https://www.realestate.com.au/property-townhouse-vic-glen+waverley-144765204
"97 Springvale Road, Glen Waverley, Vic 3150","$1,400,000 - $1,500,000",6,3,691m²,2,"Discover the epitome of luxurious family living in this exceptional 6-bedroom, 3-bathroom residence in Glen Waverley. Boasting a privileged elevated position with convenient access via the service lane, the property is ideally located near The Glen Shopping Centre, scenic parklands, and esteemed schools.,Designed for ultimate versatility, the layout caters to the needs of large or extended families. The self-contained top level, accessible via an external entry, offers the potential for short or long-term rental. Whether you choose to revel in its current charm or embark on a modern renovation, the ground floor welcomes you with a grand leadlight windowed entry, a bright lounge, a spacious family/meals area featuring a kitchen with timber cabinetry and quality appliances, and a flexible formal dining room or additional bedroom/home office.,The lower level is enhanced by three bedrooms, including the master bedroom with ample built-in robes and an ensuite. A full bathroom and a second toilet add to the functionality of this floor. Ascend to the top level, where a light-filled living/dining zone provides easy access to the second kitchen equipped with stainless steel appliances. Two bedrooms with built-in robes and another bathroom complete this floor, leading to an impressive entertainer's terrace, deck, and a charming mulch garden.,Additional features of this property include reverse cycle heating and cooling, under stairs storage, and a convenient double garage. Situated near Kingsway restaurants and shops, with entry via the service lane, the home provides easy access to amenities such as Highvale Secondary College, Highvale Primary School, Highview Park, Glen Waverley North Reserve, Larpent Reserve, Vermont South Shopping Centre, Burwood One Shopping Centre, buses, and Eastlink.,Live the Glen Waverley lifestyle to the fullest with this remarkable and adaptable family home that seamlessly combines luxury and practicality.,Disclaimer: We have in preparing this document used our best endeavours to ensure that the information contained in this document is true and accurate, but accept no responsibility and disclaim all liability in respect to any errors, omissions, inaccuracies or misstatements in this document. Prospective purchasers should make their own enquiries to verify the information contained in this document. Purchasers should make their own enquires and refer to the due diligence check-list provided by Consumer Affairs. Click on the link for a copy of the due diligence check-list from Consumer Affairs. http://www.consumer.vic.gov.au/duediligencechecklist",Leo Xu,0405127812,Jenny Zhang,0450809188,144263552,"https://i2.au.reastatic.net/800x600-resize,extend,r=33,g=40,b=46/dc8120028b54c225025c21c4b33be98b874b299b46fbc1ffc6ad8e1d5bedb397/image.jpg,https://i2.au.reastatic.net/800x600-resize,extend,r=33,g=40,b=46/5b59e72375f9428a348593e3a323ac196a9d7cfa1aee3183446d81cd8a45e6fe/image.jpg,https://i2.au.reastatic.net/800x600-resize,extend,r=33,g=40,b=46/5b59e72375f9428a348593e3a323ac196a9d7cfa1aee3183446d81cd8a45e6fe/image.jpg,https://i2.au.reastatic.net/800x600-resize,extend,r=33,g=40,b=46/747efa557bd09bd37c8a20d2479513e1a0f16474aad04295e553087c8f1f44f8/image.jpg,https://i2.au.reastatic.net/800x600-resize,extend,r=33,g=40,b=46/926c1c27ef50b89b22e95db4799486a0014d59ca489c56a78792cb4ac6b8711a/image.jpg",https://www.realestate.com.au/property-house-vic-glen+waverley-144263552
"215 Gallaghers Road, Glen Waverley, Vic 3150","$1,150,000 - $1,250,000",3,1,791m²,2,"Nestled in the heart of Glen Waverley, this property presents an incredible opportunity for both families seeking a spacious haven and savvy investors eyeing development potential (STCA). Situated on a generous 791m2 block, this residence offers a blend of comfort, convenience, and future possibilities.,Ideal Family Living: with ample space both indoors and outdoors, this home caters perfectly to family living. The expansive backyard provides endless opportunities for children to play, entertain, and create lasting memories.,Potential for Development (STCA): Developers and investors take note! With the potential for development (subject to council approval), this property offers a lucrative opportunity to capitalise on its prime location and sizeable land.,Convenient Location: Located in the sought-after suburb of Glen Waverley, residents enjoy easy access to an array of amenities including reputable schools, shopping centres, parks, and public transport options. Everything your family needs is within reach.,Property Details:,791m2 (approx.),3 Bedrooms,1 Bathroom,2 toilets ,2 living areas ,2 Car Spaces,Wall panel heaters in the lounge and the rumpus ,2 ceiling fans ,Just a short distance to the following amenities. The Glen Shopping Centre, Glen Waverley Train Station, Monash Aquatic and Recreation Centre, Kingsway Entertainment Precinct, zoned for Mount View Primary School and Highvale Secondary College , close to  prestigious schools  like Caulfield Grammar, Glen Waverley Secondary College, Glendal Primary School, Wesley College Glen Waverley Campus.,These amenities and schools contribute to the overall appeal and desirability of the location, making 215 Gallaghers Road, Glen Waverley, an ideal choice for families seeking convenience and quality education for their children.,Don't miss out on this rare opportunity to secure a property with immense potential in one of Glen Waverley's most coveted locations. Whether you're looking to create your dream family home or embark on a development project, 215 Gallaghers Road ticks all the boxes. ,AUCTION - Saturday 27th of April at 3pm.",Ping Chu,0433889936,Brad Spencer,0439899920,144709356,"https://i2.au.reastatic.net/800x600-resize,extend,r=33,g=40,b=46/92cd3025e916ab442510eb152d42ceab74e9a9bae44f01f18a3a162adb6a6437/image.jpg,https://i2.au.reastatic.net/800x600-resize,extend,r=33,g=40,b=46/92cd3025e916ab442510eb152d42ceab74e9a9bae44f01f18a3a162adb6a6437/image.jpg,https://i2.au.reastatic.net/800x600-resize,extend,r=33,g=40,b=46/639aabfcc775f20645d6f3c043c42e0e5bfb9b4a50128b97d5821925620704e5/image.jpg,https://i2.au.reastatic.net/800x600-resize,extend,r=33,g=40,b=46/c82248dde13cf17d7d103fe2401e6851f4c86d33e9c6f526aa8f8bd973f95ae3/image.jpg,https://i2.au.reastatic.net/800x600-resize,extend,r=33,g=40,b=46/833b017a64624faefdaee7b040c590e80e79d9b79ae571084fc6b4934d766bf8/image.jpg",https://www.realestate.com.au/property-house-vic-glen+waverley-144709356
"14 Cowrie Street, Glen Waverley, Vic 3150","$1,750,000-$1,850,000",5,2,669m²,4,"Certain to surpass all expectations, the classic exterior of this 4-bedroom plus study family home conceals a spectacular and carefully considered renovation where meticulous attention to detail is on display at every turn.,Thoughtfully zoned for family harmony and with an impressive raft of high-end inclusions throughout, the single level home opens to a wide entrance hall enhanced by beautiful pale oak flooring. A dedicated study with bespoke joinery is the first port of call, while opposite is a sublime carpeted master with walk-in robe and luxe fully-tiled ensuite. ,Sliding pocket doors open to reveal a central skylit lounge/sitting room while further on, discover the home's piece de resistance, its sensational entertaining zone and designer kitchen with prestige Bosch appliances (including an induction cooktop) - all crowned by soaring ceilings and filled with glorious natural sunlight. Gather with family and friends around the cosy glow of the gas fireplace in the living/dining zone, relax around the kitchen's vast stone island or throw open the banks of bi-fold doors that lead to an elevated and sheltered alfresco deck and socialise in the open air - this really is a setting that will leave you spoiled for choice.,Separately zoned in a wing of their own are three additional bedrooms - all with built-in robes. They share a stunning bathroom with spa bath, floating vanity and frameless glass shower.,Zoned heating/refrigerated cooling with a touchscreen controller is among the requisite practicalities, along with a full laundry and double garage with insulated door and both house entry & rear roller door access. A hard-wired 5-camera security system plus alarm, instantaneous hot water, 6.6kw phone-enabled solar panels, outdoor sensor lighting and double glazed windows are just a few of the many standout inclusions. There is also a German engineered 3-point lock front door (also double glazed).,In the Mount View Primary School and Brentwood Secondary College zones, the home is within striking distance of the magnificent expanses of Jells Park, the many attractions and distractions of The Glen shopping centre, various public transport options & freeways.,PLEASE NOTE:,*Every precaution has been taken to establish the accuracy of the above information but does not constitute any representation by the vendor or agent.,* Photo ID required at all open for inspections",Belinda Van Suylen,0450287007,Josh Van Suylen,0432110355,144760224,"https://i2.au.reastatic.net/800x600-resize,extend,r=33,g=40,b=46/a7e8d90cdd5151741e46372c63ef74e1579fc080c2490e822b34d3eb9d3e91bb/image.jpg,https://i2.au.reastatic.net/800x600-resize,extend,r=33,g=40,b=46/58ff34e3c36f790e8499edac580235622e145c792d82c7af6a97bd612f5edae9/image.jpg,https://i2.au.reastatic.net/800x600-resize,extend,r=33,g=40,b=46/58ff34e3c36f790e8499edac580235622e145c792d82c7af6a97bd612f5edae9/image.jpg,https://i2.au.reastatic.net/800x600-resize,extend,r=33,g=40,b=46/4e3628ae8de1a1236136378acc798d90b5bd30549335b7d15debb8be7816927e/image.jpg,https://i2.au.reastatic.net/800x600-resize,extend,r=33,g=40,b=46/b6fa57803611d07d0209982aa55b259ffcc10ae9b284dbfb3b6dd0fc0a0f24ff/image.jpg",https://www.realestate.com.au/property-house-vic-glen+waverley-144760224
"1105 52-54 O'sullivan Road, Glen Waverley, Vic 3150","$660,000 to $680,000",2,2,,1,"Ideally positioned within the prestigious Glen Waverley Secondary College catchment area (subject to school zone availability), this stylish apartment offers unparalleled convenience. Walking distance to The Glen Shopping Centre, various eateries along Kingsway, Village cinema, and Glen Waverley Train Station.,This stylish apartment embodies modern living with utmost convenience, offering seamless access to education, shopping, and transportation, thereby presenting an unparalleled lifestyle opportunity.,Features:,- An open-plan living/dining area provides a spacious and inviting ambiance.,- 2 bedrooms and 2 bathrooms. Master with ensuite and main bathroom with rainfall effect shower, floor-to-ceiling tiles and toilet. ,- Modern kitchen with stone benches, Ilve stove, Ilve oven, Fisher & Paykel dishwasher, and ample cupboard space.,- Heating and cooling systems for year-round comfort.,- Balcony with views. ,- 1 car space in the secure underground parking and a storage cage.,Experience the epitome of contemporary living in this modern apartment.,Call Conan to arrange a private inspection at 0433 900 003.,Disclaimer: We have in preparing this document used our best endeavours to ensure that the information contained in this document is true and accurate, but accept no responsibility and disclaim all liability in respect to any errors, omissions, inaccuracies or misstatements in this document. Prospective purchasers should make their own enquiries to verify the information contained in this document. Purchasers should make their own enquires and refer to the due diligence check-list provided by Consumer Affairs. Click on the link for a copy of the due diligence check-list from Consumer Affairs. http://www.consumer.vic.gov.au/duediligencechecklist.",Conan Ong,0433900003,Dr Fonny Sujanto,0434818088,144263356,"https://i2.au.reastatic.net/800x600-resize,extend,r=33,g=40,b=46/1d4aa95193383585376bc31749f17720ab0be8c5844a51b633b8ecea0f954e7e/image.jpg,https://i2.au.reastatic.net/800x600-resize,extend,r=33,g=40,b=46/456adca3c122b6e6342bf7202bcfb627fbcf68e3cb5ea34f6138c815ff2841b4/image.jpg,https://i2.au.reastatic.net/800x600-resize,extend,r=33,g=40,b=46/456adca3c122b6e6342bf7202bcfb627fbcf68e3cb5ea34f6138c815ff2841b4/image.jpg,https://i2.au.reastatic.net/800x600-resize,extend,r=33,g=40,b=46/3df825f082435d87fb94f9e2160a4889bd20d4973f50c2cf9827fa2b8ce19d53/image.jpg,https://i2.au.reastatic.net/800x600-resize,extend,r=33,g=40,b=46/1c2656ddc3158967d2a3d8e6c5ae15cb31a9eef0669540a9285513cf792d4618/image.jpg",https://www.realestate.com.au/property-apartment-vic-glen+waverley-144263356
"20A Johnson Drive, Glen Waverley, Vic 3150","$1,200,000 - $1,320,000",4,3,457m²,1,"At 29 squares (270 square metres approx.), this oversized town house offers the kind of space you'd expect in a home in the school zone for Brentwood Secondary (STSA), just a 5min drive to The Glen.,With 4 bedrooms, 3 bathrooms, a home office and its own street frontage and driveway, this is a family sized setting that still shines like new – having been built in 2019 but not occupied until 2021.,Above average in every way, this home features high ceilings on both levels, the convenience of a guest bedroom and adjoining bathroom on the ground floor and a back yard big enough for playing sport or fetch with the dog.,A bright and airy open plan kitchen and family room gives you room to entertain in style with an elite kitchen and walk-in pantry at your service.,Parents will appreciate a master bedroom with lovely north facing light and street frontage, in addition to a luxury bathroom with a freestanding bath and monsoon fixed shower head for rainfall style relaxation. ,Full height 3D white tiling brings dramatic edge to the bathrooms, with central heating, evaporative cooling, CCTV security and alarm, NBN connection and an oversized single garage with internal access adding to the impressive feature list.,Monash Fwy and Eastlink provide connections to the city and the coast, nearby Monash University, Monash Medical Centre and the new Victorian Heart Hospital, as well as popular parks, playgrounds and picnic spots including Central Reserve and Jells Park. ",Anna Du,0439417961,Jackie Chen,0433722913,144768456,"https://i2.au.reastatic.net/800x600-resize,extend,r=33,g=40,b=46/ce63c10bfd0fcdc16565c951d922fd722ac878627041f04ca1a26f08c243c1bc/image.jpg,https://i2.au.reastatic.net/800x600-resize,extend,r=33,g=40,b=46/dbb9c159f2bb60d92420894989ef641f515da7e20fe279264708d85a0a733014/image.jpg,https://i2.au.reastatic.net/800x600-resize,extend,r=33,g=40,b=46/dbb9c159f2bb60d92420894989ef641f515da7e20fe279264708d85a0a733014/image.jpg,https://i2.au.reastatic.net/800x600-resize,extend,r=33,g=40,b=46/8d371d0001e9a8fe43b3b49caac84a0b86b21c0b57862ea5c5ed48a70103a938/image.jpg,https://i2.au.reastatic.net/800x600-resize,extend,r=33,g=40,b=46/8fd91177ff4510c3a98f0aeb2b427f1df092c56e9ca091013ed0615cb4ce5313/image.jpg",https://www.realestate.com.au/property-townhouse-vic-glen+waverley-144768456
