Address,Price,Bed,Bath,Area,CarSpaces,Specification,Agent1Name,Agent1Number,Agent2Name,Agent2Number,PropertyId,Pictures,Url
"8 Lilian Street, Glen Waverley, Vic 3150","$2,955,000 - $3,250,000",6,5,681m²,2,"Shimmering with superior style and space beyond its double entry doors, this glamorous home sits elevated at lucky number 8 and offers a lifestyle of sunlit brilliance in the Pinewood Primary and Glen Waverley Secondary Zones (STSA). ,Visually stunning with a clear view down the center of the home, the residence reflects elegance and opulence with gleaming chandeliers illuminating the home whilst a formal lounge room reflects comfort with a decorative fireplace and plush carpet. Continuing further into the home you'll pass by a private study before arriving at the open plan dining zone, family room and carpeted rumpus room. ,Adding to the glamour of the room is a gourmet kitchen containing stone benches, an island breakfast bench, 900mm oven/gas stove, semi-integrated dishwasher, walk-in pantry plus a 2nd kitchen with gas stove and dishwasher. Stretching out to the side of the home, an alfresco zone awaits gatherings with friends alongside an open-air entertaining space and lush, landscaped backyard. ,Perfect for the large family or those accommodating extended family members, the ground floor contains two robed bedrooms that are connected via a central 2-way ensuite. Upstairs, a northerly oriented retreat spills out onto a balcony, while the remaining four bedrooms all feature a walk-in-robe and ensuite, with the grand master bedroom boasting a huge walk-in-robe, private balcony and lavish, dual vanity spa ensuite. ,Finished to perfection with a powder room, laundry, coat room, ducted heating, evaporative cooling, alarm, video intercom, high ceilings, Rinnai solar hot water system plus a double garage and three driveway parking spaces. ,Resting close to Pinewood Primary, Glen Waverley Secondary, Huntingtower School, Wesley College, Holmesglen Institute, Monash Aquatic Centre, Scotchmans Creek Trail, buses, trains and Monash Freeway. ",Anita Meng,04100008...,Nuria Jewell,04500008...,144676252,"https://i2.au.reastatic.net/1136x696-resize,extend,r=33,g=40,b=46/023655555e13f91dec0759c60cbda806ed04c4728efdc62e8f222ceec5038335/image.jpg,https://i2.au.reastatic.net/1136x696-resize,extend,r=33,g=40,b=46/02fa6d229a2381a5fa846c4e5109c3cf8101d904f573dc55e8d82933f189d03e/image.jpg,https://i2.au.reastatic.net/1136x696-resize,extend,r=33,g=40,b=46/02fa6d229a2381a5fa846c4e5109c3cf8101d904f573dc55e8d82933f189d03e/image.jpg,https://i2.au.reastatic.net/1136x696-resize,extend,r=33,g=40,b=46/cb9cdb196c58ffc2b2494c6d89f7aa735a05592dabcc0e246b95a6bc5f5705e1/image.jpg,https://i2.au.reastatic.net/1136x696-resize,extend,r=33,g=40,b=46/c8672fb4c9f400ec2ff3e9285cc08ee18c8b6be28e682db2470e0d2af44b12ba/image.jpg",https://www.realestate.com.au/property-house-vic-glen+waverley-144676252
"32 Roberts Street, Glen Waverley, Vic 3150","$1,450,000 - $1,550,000",4,2,750m²,1,"Neatly maintained and providing immaculate move-in ready comfort, this impeccably presented home is sure to captivate with its inviting charm and beautiful light-filled space. A welcoming ambience filters through a pristine kitchen/meals area featuring stainless steel appliances and large north-facing lounge, flowing through to a spacious dining room with access to the entertaining alfresco and generous rear garden with a peaceful terrace. Impressive accommodation is further enhanced by 3 robed bedrooms (main with ensuite) and pristine bathroom, while a family room/4th bedroom, ducted heating/AC, under house storage, cellar, 2 water tanks and single garage add further allure. Zoned for Brentwood Secondary College, walking distance to Glen Waverley South Primary, Brandon Park, The Glen, Central Reserve, train and buses and close to Caulfield Grammar and Wesley.",Di Goldsmith,04171660...,Alaine Fourie,04115130...,144678620,"https://i2.au.reastatic.net/1136x696-resize,extend,r=33,g=40,b=46/75f269bf6a396e81faf05132d3ae0ac85913f7bb5543ef2d375774875c224676/image.jpg,https://i2.au.reastatic.net/1136x696-resize,extend,r=33,g=40,b=46/75f269bf6a396e81faf05132d3ae0ac85913f7bb5543ef2d375774875c224676/image.jpg,https://i2.au.reastatic.net/1136x696-resize,extend,r=33,g=40,b=46/d03210125d77a454e2128ff33c6dd1bb85a0ae1e54d4fd71eb063c6d2c52d2f4/image.jpg,https://i2.au.reastatic.net/1136x696-resize,extend,r=33,g=40,b=46/4f9c047a79649c1b7d96863016cd5f6b001f45d3e3868fb34e01d318e7d609d7/image.jpg,https://i2.au.reastatic.net/1136x696-resize,extend,r=33,g=40,b=46/60648e82086e0684af0be55260c04e82e052ad6e89a5d934b13531a724e4d3df/image.jpg",https://www.realestate.com.au/property-house-vic-glen+waverley-144678620
"7 Ralton Avenue, Glen Waverley, Vic 3150","$3,500,000 - $3,800,000",5,4,736m²,2,"Dedicated to design excellence whilst delivering the highest level of luxury, this near new home indulges every aspect in life whilst promoting premium appointments, CBD views and prized placement in the Mount View Primary and Glen Waverley Secondary Zones (STSA). ,A celebration of quality craftsmanship, the home unfolds to reveal glamorous parquetry flooring that guides you through to a formal lounge room boasting designer lighting plus a Heat & Glo gas log fire. At the heart of the home, a double height void helps to filter light throughout, while the private theatre room comes equipped with a projector, screen and speakers and looks out towards the temperature controlled Visscool wine cellar. ,Beckoning gatherings with friends, the expansive kitchen, meals and family room is a culinary showpiece that embraces porcelain benches, Miele double ovens, Miele induction stove, integrated fridge/freezer, island breakfast bench plus a butler's kitchen boasting a Miele gas stove and Miele dishwasher. Offering a seamless transition for indoor-outdoor entertaining, glass doors with retractable flyscreens open onto an expansive entertainer's deck that's partially covered and accompanied by a synthetic turf backyard. ,Upstairs, a rumpus room provides a recreation sanctuary complete with a wet bar and accompanied by four of the five robed bedrooms including a guest bedroom with walk-in-robe and dual vanity ensuite, plus a lavish master suite with CBD views, deep balcony, dressing room and indulgent double shower ensuite. On the ground floor, the 5th bedroom benefits from a walk-in-robe and dual vanity ensuite, while the 4th bathroom rests upstairs and is supplemented by a ground floor powder room and fitted laundry with storage room and workbench. ,Finished to perfection with a 10kw solar panel system, Daikin 10 zone ducted heating/air conditioning unit, CCTV cameras, alarm, video intercom entry, keyless entry, double glazed windows, quality curtains and light switches plus a double garage with internal access and driveway gates. ,A masterpiece in every sense of the word, close to Mount View Primary, Glen Waverley Secondary, Caulfield Grammar, The Glen Shopping Centre, buses, Glen Waverley Station, Jells Park and freeways. ",Julie Wells,04088857...,Alice He,04344158...,144564724,"https://i2.au.reastatic.net/1136x696-resize,extend,r=33,g=40,b=46/3322916880d47ab6d3eb20aa8d089c79ae3f2b66d5f12760745d0b183f7370fc/image.jpg,https://i2.au.reastatic.net/1136x696-resize,extend,r=33,g=40,b=46/8a57f3ddd94ad78ca1b6062a7377de1bb8e40cafe7fb32f455927a11318c781f/image.jpg,https://i2.au.reastatic.net/1136x696-resize,extend,r=33,g=40,b=46/8a57f3ddd94ad78ca1b6062a7377de1bb8e40cafe7fb32f455927a11318c781f/image.jpg,https://i2.au.reastatic.net/1136x696-resize,extend,r=33,g=40,b=46/f9762c6291b8f0483f7daeb24deb725a2645b6c89515f3ee6a17f1328bf93dbd/image.jpg,https://i2.au.reastatic.net/1136x696-resize,extend,r=33,g=40,b=46/bd8c63045052bc94b1b552213eb363b473ded70a225901fdf9544ea576247f62/image.jpg",https://www.realestate.com.au/property-house-vic-glen+waverley-144564724
"33 Johnson Drive, Glen Waverley, Vic 3150","$3,250,000",6,6,655m²,2,"This prestigious home presents an abundance of luxury and space situated in the Brentwood Secondary School Zone.,Superbly presented, this home is filled with style, sophistication and warmth.,Double doored entry opens into an impressive entry foyer that flows over French Oak parquetry flooring and leads past the study and living/entertainment room where recessed speakers are accompanied by a projector and comforting carpet.,With double height ceiling and soaring windows draw northerly sunshine into the family room, set beside the grandeur dining area and state-of-the-art kitchen incorporating a massive island bench ,soft closing cabinets ,Fisher & Paykel appliances, bosch dishwasher, double ovens and 900 mm gas stove . Adjacent is a spacious Butler's Kitchen and pantry including a bosch dishwasher.,Designed for entertaining the clever additions of a bi-fold servery window that allows the chef to serve food out to the undercover alfresco area which opens to the family room with a sliding doors. .In addition is this north facing backyard with low maintence garden perfect for the family to enjoy.,On the ground floor at the rear of the home is a guest room /6th bedroom which boasts a walk-in-robe and ensuite with a dual vanity and double shower , further accompanied by a powder room and laundry with large benchtop and walk-in linen press. A wide staircase with a view of a beautiful ceiling chandelier leads to the fully carpeted spacious retreat and five remaining bedrooms all with their own walk-in-robes and ensuites, including the lavish master bedroom fit for a queen featuring an adjoining  retreat,  grand dressing room and luxurious ensuite with dual vanities, sumptuous freestanding bathtub, rainfall effect shower and separate toilet.,Extra luxuries include High ceilings, remote driveway gates , ducted heating, evaporative cooling, CCTV cameras, video intercom, LED downlights, remote curtain,walk-in storage room plus a double garage with internal access.,Walking distance to Brentwood Secondary College and Glen Waverley South Primary, near Caulfield Grammar,  Monash Uni, Central Reserve, Monash Aquatic Centre, Brandon Park Shopping Centre, The Glen, buses, trains and freeways.,Photo ID required at all open inspections",Natalie Visic,04665270...,Nick Kamaretsos,04387742...,143892856,"https://i2.au.reastatic.net/1136x696-resize,extend,r=33,g=40,b=46/30651ee2806fa359caa4e66fe60c0c3ae112ed10af6f29caf72badf2c2ef6caa/image.jpg,https://i2.au.reastatic.net/1136x696-resize,extend,r=33,g=40,b=46/9ec8e3425d26681e495175083de23a46bcca6c22082a3a8508a696e495966947/image.jpg,https://i2.au.reastatic.net/1136x696-resize,extend,r=33,g=40,b=46/9ec8e3425d26681e495175083de23a46bcca6c22082a3a8508a696e495966947/image.jpg,https://i2.au.reastatic.net/1136x696-resize,extend,r=33,g=40,b=46/c641916f8218d2a85981428c5330d38d819b6c45cadbc1b2c1716afa8de61b59/image.jpg,https://i2.au.reastatic.net/1136x696-resize,extend,r=33,g=40,b=46/3d9ea0de5a421e494e79cfddf61e900fda046fb10259f65212aa4dfe548820e6/image.jpg",https://www.realestate.com.au/property-house-vic-glen+waverley-143892856
"32 Clifford Street, Glen Waverley, Vic 3150","New Price $2,300,000 - $2,400,000",3,2,661m²,2,"Situated in a prime location and in arguably one of Glen Waverley's most sought-after streets, get ready to reap the rewards of this grand land and premier residential proposition on this 724m2 (approx.) allotment.,Combining this privileged position with premier potential, much-loved home offers the perfect live-in or rent-out opportunity for the family keen to build a palatial mansion in central Glen Waverley with Glen Waverley Secondary College only meters from your doorstep.,The choice is yours – ready to live in or lease out while you consider plans for the future – renovate, rebuild your dream home or redevelop two townhouses (STCA).,Enviably situated in the GWSC Zone, only a short walk from Wesley College, Glen Waverley Primary, The Glen with its recent renovations, Glen Waverley Train Station, the culinary delights of Kingsway, whilst within close proximity to both Monash and EastLink Freeways.,Disclaimer: We have in preparing this document used our best endeavours to ensure that the information contained in this document is true and accurate, but accept no responsibility and disclaim all liability in respect to any errors, omissions, inaccuracies or misstatements in this document. The fixtures, fittings, appliances and services have not been tested and no guarantee as to their functionality or efficiency can be provided. Distances and timings are approximate. Prospect purchasers should independently verify the information contained in this document and refer to the due diligence check-list provided by consumer affairs. Click on the link for a copy of the due diligence check-list: http://www.consumer.vic.gov.au/duediligencechecklist,    ",Andy Lou,04332916...,Belinda Leng,04321563...,142789908,"https://i2.au.reastatic.net/1136x696-resize,extend,r=33,g=40,b=46/9aa731cb9ea5749eba9ac5394e0ad0a9ae7f1bbebc597ab127927fdfab8aa412/image.jpg,https://i2.au.reastatic.net/1136x696-resize,extend,r=33,g=40,b=46/9aa731cb9ea5749eba9ac5394e0ad0a9ae7f1bbebc597ab127927fdfab8aa412/image.jpg,https://i2.au.reastatic.net/1136x696-resize,extend,r=33,g=40,b=46/e684898219824e775df5069b6aa60097a56a3ff37735a6d6705f595d67f08fab/image.jpg,https://i2.au.reastatic.net/1136x696-resize,extend,r=33,g=40,b=46/df19b910691fb5a22d8d6053361807cb56a62e454851aa9789829810f5b40309/image.jpg,https://i2.au.reastatic.net/1136x696-resize,extend,r=33,g=40,b=46/2d6874a60b9dd68282b1c0c6bc16efe62843042ce85ccaf646231294ad663da0/image.jpg",https://www.realestate.com.au/property-house-vic-glen+waverley-142789908
"1/107 Bogong Avenue, Glen Waverley, Vic 3150","$750,000 - $820,000",2,1,350m²,1,"Situated at the front of a small unit complex with its own separate driveway and garage this well-maintained light filled freestanding unit offers the perfect setting for first home buyers, downsizers or investors wishing to purchase in the elite Glen Waverley Secondary Catchment. ,Nestled within walking distance to Glen Waverley train station, Glen Shopping Centre, theatres, cafes and restaurants, the home's generous dimensions have been well-planned with the open plan living, dining and gally style kitchen with gas cooktop, under bench oven and dishwasher, bathroom with shower, bath, vanity, skylight and separate toilet, 2 robed bedrooms, delightful rear yard with decking area and gated access to the front of the property. ,Extra inclusions are external sunblinds, gas ducted heating, split system cooling and ceiling fans in the bedrooms. ,Photo ID required at all open for inspections.,Disclaimer: We have in preparing this document used our best endeavors to ensure that the information contained in this document is true and accurate, but accept no responsibility and disclaim all liability in respect to any errors, omissions, inaccuracies or misstatements in this document. Prospective purchasers should make their own enquiries to verify the information contained in this document. Purchasers should make their own enquires and refer to the due diligence check-list provided by Consumer Affairs. Click on the link for a copy of the due diligence check-list from Consumer Affairs. http://www.consumer.vic.gov.au/duediligencechecklist,    ",Sue Kelly-Brown,04183478...,Trisha Tan,04216670...,144291304,"https://i2.au.reastatic.net/1136x696-resize,extend,r=33,g=40,b=46/16303632b73643b16c64785b7afac0377bc654b008a4d15b5cdc7749d8b87fbb/image.jpg,https://i2.au.reastatic.net/1136x696-resize,extend,r=33,g=40,b=46/3cbc5a2c7390069b98aa2754d24a2a0af4cca3ae0f84e5fb5da1f2e1fb47dda5/image.jpg,https://i2.au.reastatic.net/1136x696-resize,extend,r=33,g=40,b=46/3cbc5a2c7390069b98aa2754d24a2a0af4cca3ae0f84e5fb5da1f2e1fb47dda5/image.jpg,https://i2.au.reastatic.net/1136x696-resize,extend,r=33,g=40,b=46/cd3a91dcf614f4fc323537eef29237158c1042f44986bf6cf73db777fa2a04dc/image.jpg,https://i2.au.reastatic.net/1136x696-resize,extend,r=33,g=40,b=46/56b446ef3f6d1541231e18f1f6fedefb2a8728e8d9a9092cd7b0772028cb6cbe/image.jpg",https://www.realestate.com.au/property-unit-vic-glen+waverley-144291304
"16 Coolabah Avenue, Glen Waverley, Vic 3150",,3,2,658m²,2,"This much-loved home is in pristine condition and is immaculately presented.  Warm and inviting, this home is perfectly situated on a 658m2 block.  This allows an abundance of natural light through large picture windows into every room.  This property has been recently refurbished.  It has been freshly painted inside and out, has new plush pile carpets and new LED light fittings, all complemented by a complete roof restoration.  This well-appointed home has three bedrooms and another large multi-purpose room which could be your study, work from home space, third living area or a nursery.  The large private master bedroom has an ensuite and built-in mirrored wardrobes.,This home is an entertainer's delight, with a central custom-designed kitchen, fully appointed with Miele appliances and also features a combination microwave/second oven, and Corian benchtops.  Welcome your family and friends into the large formal lounge/dining area or the large family/meals area, both adjoining the kitchen.  Enjoy time on the expansive timber deck or under the shade of a mature Golden Elm tree which stands proud amongst a landscaped garden.  Relax in your large indoor Hot Spring Spa after work or unwind in front of your gas log fireplace.,This property is close to many sought after schools such as Glen Waverley South Primary, Brentwood Secondary College, Wesley College and Caulfield Grammar.  An easy walk takes you to Brandon Park Shopping Centre, while The Glen shopping centre, Glen Waverley station and Monash Aquatic and Recreation Centre are all nearby.,Simply move in and enjoy!,Expression of interest closing 16 April 2024 @ 4.00pm,Disclaimer:  Every precaution has been taken to establish the accuracy of the above information but it does not constitute any representation by the vendor/agent and agency.",Adrian Santini,04011996...,,,144564720,"https://i2.au.reastatic.net/1136x696-resize,extend,r=33,g=40,b=46/dda98b5162cdb62d3caf1263a2387b3b8ab67f6e85250ca9b2ef4110c58ea930/image.jpg,https://i2.au.reastatic.net/1136x696-resize,extend,r=33,g=40,b=46/dda98b5162cdb62d3caf1263a2387b3b8ab67f6e85250ca9b2ef4110c58ea930/image.jpg,https://i2.au.reastatic.net/1136x696-resize,extend,r=33,g=40,b=46/c7220d58d74392fdeb0f4640de674d65af61dbc2f5e6055e26a37db2cba2ad80/image.jpg,https://i2.au.reastatic.net/1136x696-resize,extend,r=33,g=40,b=46/f34467846a8500ba92d537ed191a0673cd03742c2034f67a65dbea41d407d9e7/image.jpg,https://i2.au.reastatic.net/1136x696-resize,extend,r=33,g=40,b=46/be6c14e4c80554807c6e513139140743ff27a7314d4d3ac415e8f58512d7ab59/image.jpg",https://www.realestate.com.au/property-house-vic-glen+waverley-144564720
"Grande Floorplan/42- Capital Avenue, Glen Waverley, Vic 3150","$335,000 - $360,000*",1,1,,1,"Welcome to a new way to have a placid and serene lifestyle in the compact and comfortable Grande floorplan. Don’t miss this opportunity to live in one of our Grande apartments at Highvale.,Some of the key features of this Serviced Apartment floorplan include:,• open plan style kitchenette and living area,• generous bedroom with a built-in or walk-in robe,• private and modern bathrooms,• some apartments also have a European style laundry for your convenience,• enjoy different views, such as a balcony, a private courtyard, or a courtyard view depending on the location of the property you purchase.,About Highvale Retirement Village by Keyton,Nestled close to Glen Waverley's scenic parklands and nearby shopping centres, Highvale Retirement Village offers a modern setting for your dream retirement lifestyle. This sustainable, pet-friendly community boasts climate-conscious landscaping and communal vegetable gardens, ensuring a relaxing and enriching retirement lifestyle. Whether you prefer a well-appointed villa or the added support of our serviced apartments, Highvale offers a range of living options to suit your preferences.,Immerse yourself in exceptional amenities and a vibrant calendar of social events set against a relaxed suburban backdrop.,Highvale Village amenities include;,• Community centre,• Gym facilities,• Village bus for shopping and outings,• Library and welcoming communal spaces,• Regular visits from hairdressers and podiatrists,• Newspaper and chemist deliveries,• 24-hour emergency call system,Next Steps,We welcome you to book a village tour to learn more about the floorplans on offer and the lifestyle you could lead in Keyton’s Highvale Serviced Apartments. Book a tour with us today!,*Prices correct as of November 2023. Photographs are for illustrative purposes. Some images may depict items not provided by Keyton within the units, such as furniture and other decorative items.",Courtney Di Gregorio,18005505...,,,143034020,"https://i2.au.reastatic.net/1136x696-resize,extend,r=33,g=40,b=46/project/image.jpg,https://i2.au.reastatic.net/1136x696-resize,extend,r=33,g=40,b=46/2208e278ce76e690bbc379e04ef9f9e7094e2c6045ce050d2fbfbaccdbe9b1e7/image.jpg,https://i2.au.reastatic.net/1136x696-resize,extend,r=33,g=40,b=46/www.realestate.com.au/image.jpg,https://i2.au.reastatic.net/1136x696-resize,extend,r=33,g=40,b=46/listing/image.jpg,https://i2.au.reastatic.net/1136x696-resize,extend,r=33,g=40,b=46/agency/image.jpg",https://www.realestate.com.au/property-serviced+apartment-vic-glen+waverley-143034020
"Cove Floorplan/42-60 Capital Avenue, Glen Waverley, Vic 3150","$90,000 - $120,000*",1,1,,1,"Feel at home in this welcoming and peaceful serviced apartment apartment floorplan with everything you need for a comfortable and stress-free living. Don’t miss this opportunity to live in one of our Cove apartments at Highvale.,Some of the key features of this Serviced Apartment floorplan include:,• a kitchenette,• a living/bedroom space with built-in closets, and a private bathroom,• enjoy different views, such as a balcony, a private courtyard, or a courtyard view depending on the location of the property you purchase.,About Highvale Retirement Village by Keyton,Nestled close to Glen Waverley's scenic parklands and nearby shopping centres, Highvale Retirement Village offers a modern setting for your dream retirement lifestyle. This sustainable, pet-friendly community boasts climate-conscious landscaping and communal vegetable gardens, ensuring a relaxing and enriching retirement lifestyle. Whether you prefer a well-appointed villa or the added support of our serviced apartments, Highvale offers a range of living options to suit your preferences.,Immerse yourself in exceptional amenities and a vibrant calendar of social events set against a relaxed suburban backdrop.,Highvale Village amenities include;,• Community centre,• Gym facilities,• Village bus for shopping and outings,• Library and welcoming communal spaces,• Regular visits from hairdressers and podiatrists,• Newspaper and chemist deliveries,• 24-hour emergency call system,--Next Steps--,We welcome you to book a village tour to learn more about the floorplans on offer and the lifestyle you could lead in Keyton’s Highvale Serviced Apartments. Book a tour with us today!,*Prices correct as of November 2023. *Photographs are for illustrative purposes. Some images may depict items not provided by Keyton within the units, such as furniture and other decorative items.",Courtney Di Gregorio,18005505...,,,143854160,"https://i2.au.reastatic.net/1136x696-resize,extend,r=33,g=40,b=46/project/image.jpg,https://i2.au.reastatic.net/1136x696-resize,extend,r=33,g=40,b=46/2208e278ce76e690bbc379e04ef9f9e7094e2c6045ce050d2fbfbaccdbe9b1e7/image.jpg,https://i2.au.reastatic.net/1136x696-resize,extend,r=33,g=40,b=46/www.realestate.com.au/image.jpg,https://i2.au.reastatic.net/1136x696-resize,extend,r=33,g=40,b=46/listing/image.jpg,https://i2.au.reastatic.net/1136x696-resize,extend,r=33,g=40,b=46/agency/image.jpg",https://www.realestate.com.au/property-serviced+apartment-vic-glen+waverley-143854160
