Address,Price,Bed,Bath,Area,CarSpaces,Specification,Agent1Name,Agent1Number,Agent2Name,Agent2Number,PropertyId,Pictures,Url
"3/12 Chivers Avenue, Glen Waverley, Vic 3150","$900,000 - $990,000",3,2,312m²,2,"Welcome to your perfect sanctuary, where comfort and convenience harmonize seamlessly. This townhouse presents an ideal living space, featuring a master bedroom downstairs and two additional bedrooms upstairs. Whether you're unwinding in the expansive living areas or hosting gatherings in the stylish kitchen, this residence offers a versatile and welcoming atmosphere for modern living.,Enjoy modern amenities including split system cooling and heating, a gas cooktop, and timber flooring in the ground floor living area. Brand new carpets adorn all bedrooms and the living area upstairs for added comfort. With only 3 units on the block, this property is situated at the rear for added privacy, with private access to a street/walking laneway leading to nearby Pinewood Tennis Club and Callaghan Reserve.,For families, rest assured knowing that top-ranking schools such as Brentwood Secondary College and Pinewood Primary School are within school zone, providing exceptional education opportunities for your children.,Discover the pinnacle of suburban living where every comfort is within your grasp. Don't let this opportunity pass you by - make this townhouse your new home, where convenience intertwines with luxury to create an unparalleled living experience.,Immerse yourself in the ease of suburban life with effortless access to major shopping centers, public transport hubs, and major highways. Explore the vibrant shopping scenes of Glen Waverley Shopping Center and Pinewood Shopping Center or hop on a train at Glen Waverley Train Station for convenient travel. With the M1 freeway nearby, adventures in and around Melbourne are within easy reach.",Jack Qi,04519785...,Effie Ma,04739877...,144583124,"https://i2.au.reastatic.net/1136x696-resize,extend,r=33,g=40,b=46/50cd87c398489c940258bef116d7dcd041112df109566c272d932d5db51b8b3d/image.jpg,https://i2.au.reastatic.net/1136x696-resize,extend,r=33,g=40,b=46/0c5cfd0d071811c8aca0618bbba162e334aa6fc7aca97c756e6f318a494382c5/image.jpg,https://i2.au.reastatic.net/1136x696-resize,extend,r=33,g=40,b=46/0c5cfd0d071811c8aca0618bbba162e334aa6fc7aca97c756e6f318a494382c5/image.jpg,https://i2.au.reastatic.net/1136x696-resize,extend,r=33,g=40,b=46/7a85dc7c99ea4f167573d0cb500a2a4498fc8215c757ebb97baf0ffd59526dfa/image.jpg,https://i2.au.reastatic.net/1136x696-resize,extend,r=33,g=40,b=46/1ceba9bb00994a5100d77adb132762c35c0d06da23fac8a49ee34053b8111235/image.jpg",https://www.realestate.com.au/property-townhouse-vic-glen+waverley-144583124
"2/318-320 Blackburn Road, Glen Waverley, Vic 3150","$860,000",2,1,,1,"This well-maintained unit is bathed in natural light and stunning timber floorboards flow throughout. Nestled quietly at the rear of only 4 units on the block it is located within the esteemed Glen Waverley Secondary Zone (STSA).,Featuring 2 separate living areas including a generous lounge and dining room flowing through to an updated kitchen and meals area with a tranquil sunny outlook. The kitchen is enhanced by an abundance of cabinetry, a gas cooktop and electric oven.,Accommodation comprises of two spacious, robed bedrooms serviced by a well-appointed bathroom including a bathtub plus a separate toilet. Extra comforts include ceiling fans to bedrooms and living room, a sizeable separate laundry, lock up garage, a private courtyard and low maintenance garden surrounds.,Centrally located in a prime location with public transport at your doorstep and a short stroll to the train station and Syndal South Primary, with easy access to The Glen Shopping Centre, Century City Entertainment centre, Wesley College, Huntingtower School, Valley Reserve, walking tracks and Monash and Eastlink Freeways.",Frankie Jayne,04393284...,Robert Namour,03980304...,143569024,"https://i2.au.reastatic.net/1136x696-resize,extend,r=33,g=40,b=46/34292168260fb2c1887bced340909061f6310eb381874b0034942ad1e2036f5a/image.jpg,https://i2.au.reastatic.net/1136x696-resize,extend,r=33,g=40,b=46/34292168260fb2c1887bced340909061f6310eb381874b0034942ad1e2036f5a/image.jpg,https://i2.au.reastatic.net/1136x696-resize,extend,r=33,g=40,b=46/4fae3cb6e2ffde84355533e7338b413e074f536135adbc4cb2ebf1b3ca45c8d8/image.jpg,https://i2.au.reastatic.net/1136x696-resize,extend,r=33,g=40,b=46/346bc94b14036d706effcc9d63d961a8bfbc9587546c583a47c0c2ccdb337080/image.jpg,https://i2.au.reastatic.net/1136x696-resize,extend,r=33,g=40,b=46/97b917ffd96ad6fdab7a6fbc30b01ef9a5e057826d8fd7c248fc3fbacaaeb919/image.jpg",https://www.realestate.com.au/property-unit-vic-glen+waverley-143569024
"3/1 McKelvie Court, Glen Waverley, Vic 3150","Auction $750,000 - $825,000",3,2,240m²,2,"A private position in the leafy ‘England Gardens’ estate makes for relaxed living close to Pinewood Shopping Village, Pinewood Primary, Notting Hill Tennis Club and Monash Fwy.,Set behind charming picket fences, number 3 claims a quiet corner and offers secure internal entry via a single garage.  ,An extra car space on its driveway and nearby visitor parking also gives you options for those with 2 cars.,The elegant brick and rendered town home adds to its charm inside under high ceilings, with floating floors throughout and plenty of natural light across both the living rooms and bedrooms.,The two-storey floor plan is thoughtfully designed with the front living room, meals area and study attracting lovely light through the generous windows, and a second living area upstairs adding to the sense of space.,Stylish black stone top benches, high gloss cabinets and Blanco appliances grace the kitchen. Two bathrooms include a family bathroom with both bath and shower, and an ensuite with its own private shower and toilet.,It’s the perfect modern family setting with low maintenance freedom, with common gardens to enjoy, close to all the essentials including schools, shops, parks and sporting facilities and the Monash Fwy city to coast connection behind a sound barrier.",Steven Yuen,04126434...,Bruce Liu,04245761...,144581988,"https://i2.au.reastatic.net/1136x696-resize,extend,r=33,g=40,b=46/abcd48fb4670c28a3320c67240af78c7222022014e315d0559ad39a8d454d3c9/image.jpg,https://i2.au.reastatic.net/1136x696-resize,extend,r=33,g=40,b=46/abcd48fb4670c28a3320c67240af78c7222022014e315d0559ad39a8d454d3c9/image.jpg,https://i2.au.reastatic.net/1136x696-resize,extend,r=33,g=40,b=46/bc335715fb62dc71d068e1458be5c9022af8456d5d1541ab99deb3f31ca3132c/image.jpg,https://i2.au.reastatic.net/1136x696-resize,extend,r=33,g=40,b=46/6d15e709bc52b2a21d5e4fde12e0541ab51551b44e09e719acd94bbfeed5e061/image.jpg,https://i2.au.reastatic.net/1136x696-resize,extend,r=33,g=40,b=46/28970b2273f25c0885081533afcb81974b4d8776f5037f92c0fc1d390de8616e/image.jpg",https://www.realestate.com.au/property-townhouse-vic-glen+waverley-144581988
"5A Walter Street, Glen Waverley, Vic 3150","$2,200,000",5,3,,2,"Unique style with stunning views!,Offering first class and stylish attention to detail, this architecturally designed 5 bedroom, 4 toilets, 3 bathroom family residence is the perfect home for any family and particularly one looking for space to grow. ,This dual level executive home truly makes a statement, from the striking external design to the exquisite fittings and fixtures featured throughout the property. The centerpiece central living zone has separate areas for both lounging and dining with a stunning gas fireplace. The glorious kitchen truly is a sight to behold with a feature black granite island bench, stylish splashback, soft-closing drawers, Siemens induction cooktop, dual pyrolytic ovens and dishwasher. There is also a butler's pantry with a gas cooktop making meals preparation a breeze. ,You have the pick of two master bedrooms on the ground and top levels, both come with tailored walk-in robes, sumptuous ensuites fitted with sublime tapware and timber detailed vanities. There are also two additional bedrooms upstairs which have access to a gorgeous main bathroom, as well as a versatile retreat. ,The undercover decking off the central living hub and surrounding landscaped gardens provides you with excellent alfresco options, while further features include a downstairs powder room, spacious laundry and a double garage. Downstairs also offers a generous fifth bedroom or study option and includes a large versatile multipurpose room, connected to all services, that awaits your specific needs or a multitude of uses.,This home shares no common land and comes fully optioned with ducted heating, air conditioning, video intercom, security cameras, electric blinds and 3 phase power with solar panels and battery to suit your EV needs.,Moments to The Glen Shopping Centre and surrounding cafes and restaurants, Wesley College, Glendal Primary School, Glen Waverley North Reserve, local buses, and Glen Waverley Station.",Mark Watkins,04113962...,,,144419440,"https://i2.au.reastatic.net/1136x696-resize,extend,r=33,g=40,b=46/a57b8854bd379022c259a04078741917da2e40389312e9ad95676f7cd1374895/image.jpg,https://i2.au.reastatic.net/1136x696-resize,extend,r=33,g=40,b=46/8652d955def75938388345c09ff9eb4127e09da6e38620801395ce5a84a78e9c/image.jpg,https://i2.au.reastatic.net/1136x696-resize,extend,r=33,g=40,b=46/12712fd505eef2d1bf653403d82fd2b37c11519aa469ce9c69df4aa87a7b6831/image.jpg,https://i2.au.reastatic.net/1136x696-resize,extend,r=33,g=40,b=46/501414c77a6be9fac8a156105441e4549ed1b4ae89cd320fe1e95363b1fdd917/image.jpg,https://i2.au.reastatic.net/1136x696-resize,extend,r=33,g=40,b=46/b6e98d8b700295e05b084a6f8bc501f3d8d945cdb4861df105da120225665c59/image.jpg",https://www.realestate.com.au/property-house-vic-glen+waverley-144419440
"1/723 Waverley Road, Glen Waverley, Vic 3150",,3,1,,1,"First home buyers, downsizers and investors, light, bright single level unit, offering formal living room flowing into the dining room family area, servery window from the kitchen with multiple cupboards, pantry all facing the preferred North facing direction.  Wonderful entertaining inside and out to the paved backyard. ,Three bedrooms, two with built in robes, single carport and parking space in front.,Close to The Glen, buses, Glen Waverley Station and reserves.  Monash Aquatic Centre, Monash University and easy access to Monash freeway Eastlink and Brentwood Secondary School (S.T.A).,Disclaimer:  Every precaution has been taken to establish the accuracy of the above information but it does not constitute any representation by the the vendor/agent and agency.",Adrian Santini,04011996...,Karen Chiverton,04091449...,144666024,"https://i2.au.reastatic.net/1136x696-resize,extend,r=33,g=40,b=46/a1bb89b5d2c2846a9d694812867bf76efe3d303c70ebc1df49f2f7fa6378ff23/image.jpg,https://i2.au.reastatic.net/1136x696-resize,extend,r=33,g=40,b=46/a1bb89b5d2c2846a9d694812867bf76efe3d303c70ebc1df49f2f7fa6378ff23/image.jpg,https://i2.au.reastatic.net/1136x696-resize,extend,r=33,g=40,b=46/1ea252987cf9331e7fd4ebd62f4862ca7300cc0a780f225708e1b8f1b9a90946/image.jpg,https://i2.au.reastatic.net/1136x696-resize,extend,r=33,g=40,b=46/2a0a19ffd8898a412068b053c0319db923c7922d0183c7684d0c4be36cfb74ff/image.jpg,https://i2.au.reastatic.net/1136x696-resize,extend,r=33,g=40,b=46/cc5b7c353c839819fd8f44405e76691e8c5e9d2d46b44ae898d9d1f2ea5ee1eb/image.jpg",https://www.realestate.com.au/property-unit-vic-glen+waverley-144666024
"2/38 Danien Street, Glen Waverley, Vic 3150",$900K-$990K No Body Corp GWSZ,3,1,,2,"Rarely available yet highly coveted, this forward thinking home with no body corp fees, situated on a corner lot with its own driveway, embodies a perfect blend of light-filled space, easy-care living, with the option to maximise the untapped potential on offer. Just a stone's throw away from Glen Waverley Central, this residence offers a seamless flow of comfort and style.,An evergreen front garden invitingly draws you in, where you are greeted by polished timber floors as they lead the way into a home designed for relaxed and spacious living. Central to the home is the modern kitchen, overlooking the peaceful rear courtyard, featuring gas cooking and ample counter space, connecting to a cozy meals area and family room that leads to a covered outdoor deck for entertaining. ,The generously proportioned bedrooms all come with robes, the master bedroom enjoying private access to the main bathroom. Stylishly presented, the bathroom features a family friendly bath, shower and vanity, while a separate laundry rounds out the living spaces.,The real surprise begin with the lower level, which has been partially prepared to be converted to a full self contained living area, with available connections for a kitchen and bathroom, while the current living area can be easily partitioned to create a separate bedroom and open plan living room. The untapped potential is very clear to see, adding huge value to for the astute buyer.,The home is equipped with ducted heating, evaporative cooling, new carpets and stylish new blinds. A double garage and off street parking providing ample car accommodation. Situated in the sought-after Glen Waverley Secondary and Glen Waverley Primary School Catchment Zones (STSA) and just a short stroll to Glen Waverley Train Station, Village Cinemas, Kingsway eateries, and The Glen shopping centre, this property offers a lifestyle of convenience and comfort.",Tony Ievoli,04228697...,Freeman Li 李,04217802...,144552680,"https://i2.au.reastatic.net/1136x696-resize,extend,r=33,g=40,b=46/ecc7c972882581c755fb8e1a66a21ab291b0f2c351a0be70c9bb3772e28d0068/image.jpg,https://i2.au.reastatic.net/1136x696-resize,extend,r=33,g=40,b=46/ecc7c972882581c755fb8e1a66a21ab291b0f2c351a0be70c9bb3772e28d0068/image.jpg,https://i2.au.reastatic.net/1136x696-resize,extend,r=33,g=40,b=46/d622d559f334633d2123acafdf95e66c5084243e71fbb5008d983f0aedd6af71/image.jpg,https://i2.au.reastatic.net/1136x696-resize,extend,r=33,g=40,b=46/0973b9b064b7036675858e0bab49a563f0088799f12ff31329d9703871b7c891/image.jpg,https://i2.au.reastatic.net/1136x696-resize,extend,r=33,g=40,b=46/d2ab71151ff627eee692944951b8c43bc4993d0823420d2449a3644f101b2b82/image.jpg",https://www.realestate.com.au/property-townhouse-vic-glen+waverley-144552680
"999 High Street Road, Glen Waverley, Vic 3150","$1,450,000 - $1,550,000",3,2,640m²,2,"This corner allotment with access via Knights Drive and on a service road, presents an ideal canvas for future possibilities. Whether envisioning the development of distinct townhouses, each with its own street frontage (STCA), or crafting your dream home, the potential here is vast. ,Meanwhile, the existing 3-bedroom, 2-bathroom residence stands ready to provide a temporary rental income while awaiting plans and permits. The heart of this home lies in its kitchen, adorned with beautiful timber cabinetry, seamlessly connected to a cosy meals/family room, beyond its doors, a covered alfresco area beckons.,Nestled within the coveted Mount View Primary Catchment and in proximity to Highvale Secondary, Wesley College, the scenic Dandenong Creek Nature Trail, The Glen Shopping Centre, transportation hubs, as well as the convenience of Monash and East Link Freeways, this location offers both accessibility and serenity.",Calvin Huang,04336257...,Tori Liu,04304798...,143687160,"https://i2.au.reastatic.net/1136x696-resize,extend,r=33,g=40,b=46/4f3a3ad60b32122c9e882706580b514cb6b34371c955ff6e60c5cbc54d5c832f/image.jpg,https://i2.au.reastatic.net/1136x696-resize,extend,r=33,g=40,b=46/2f9c57a9c5ace695f9f7803493f0b35cdf6b1a3ed7fb399e4e002603b8de50a8/image.jpg,https://i2.au.reastatic.net/1136x696-resize,extend,r=33,g=40,b=46/2f9c57a9c5ace695f9f7803493f0b35cdf6b1a3ed7fb399e4e002603b8de50a8/image.jpg,https://i2.au.reastatic.net/1136x696-resize,extend,r=33,g=40,b=46/89d85e272ed0a2e6714226deaf23a196b2f868cfbc21a3a0b114f127986b49a4/image.jpg,https://i2.au.reastatic.net/1136x696-resize,extend,r=33,g=40,b=46/770264588d29cd69348497eb93d480c737790c209cd4f8044dea7aa5b3e375b4/image.jpg",https://www.realestate.com.au/property-house-vic-glen+waverley-143687160
"1  Armour Close, Glen Waverley, Vic 3150","$1,450,000 - $1,550,000",4,3,647m²,2,"Prepare to establish family foundations in the Legend Park Estate on a north facing corner zoned for Camelot Rise Primary and Highvale Secondary College (STSA).,A grand floor plan offers magnificent sized living space with 4 bedrooms plus a study/5th bed, set over two levels for the ultimate flexibility.,The spectacular heights of the entrance void deliver a sense of dramatic space, with mountain views of The Dandenong Ranges enhancing that open, airy feeling.,For families wanting room for intergenerational living and to give every child their own bedroom, this substantial setting caters for modern family living with 2 bedrooms on each level, and a versatile extra room suited as a nursery or home office.,Spacious bathrooms, a fully featured kitchen with Euro appliances, ducted heating, air con and a garage with entrance on Avalon Ave provide all the essential comforts. ,Designed for plenty of outdoor adventure, with two pergolas, private fencing and a lovely park and playground at the end of the court. So close to schools you can walk, with a choice of shopping at The Glen, Vermont South Shopping Centre, Burwood Plaza and Westfield Knox, nearby Eastlink from city to the coast, and the Dandenong Creek Trail to walk or cycle to Jells Park.  ",Anna Du,04394179...,Jackie Chen,04337229...,144666148,"https://i2.au.reastatic.net/1136x696-resize,extend,r=33,g=40,b=46/d7bc868660e2b936eb1168eb2093c2fd088dc71a2a92b583d6abb0db7f65cf19/image.jpg,https://i2.au.reastatic.net/1136x696-resize,extend,r=33,g=40,b=46/0f2289c3077da49eeee999ef1e955ce25cab8333537f76410586a534e5fd9746/image.jpg,https://i2.au.reastatic.net/1136x696-resize,extend,r=33,g=40,b=46/0f2289c3077da49eeee999ef1e955ce25cab8333537f76410586a534e5fd9746/image.jpg,https://i2.au.reastatic.net/1136x696-resize,extend,r=33,g=40,b=46/c6dbaafccaceda8f375fa62e38cda065e4cee4b788984fffdbe883d60ce09bd4/image.jpg,https://i2.au.reastatic.net/1136x696-resize,extend,r=33,g=40,b=46/4e0409b5c97e4a40be9b9b97fea7f94a0f574991e2c313f79d1e94cd642acb4b/image.jpg",https://www.realestate.com.au/property-house-vic-glen+waverley-144666148
"2/4 Allen Street, Glen Waverley, Vic 3150","Auction : $830,000 - $910,000",3,2,265m²,2,"Tucked away in the serene suburb of Glen Waverley, this charming three-bedroom brick veneer residence is a haven of space and luminosity, boasting ample open areas bathed in natural light from its generously sized windows. The home unfolds with an inviting open plan layout, where the kitchen, equipped with a breakfast bar, dishwasher, gas cooktop, and electric oven, seamlessly flows into the spacious dining area. A step away, the separate formal lounge offers a quiet retreat.,The master bedroom is a private sanctuary, featuring a walk-in wardrobe and an ensuite for ultimate convenience. The additional bedrooms, each fitted with built-in robes, share access to the main bathroom, which includes a bath, shower, and toilet, catering to all your family's needs.,This home is loaded with desirable amenities, including polished timber floorboards, ducted heating, cooling for year-round comfort, a secure double lock-up garage, and a generously sized rear yard for outdoor enjoyment.,Situated in a highly sought-after locale, you're just a stroll away from Monash Aqualink and the vast expanses of Central Reserve. With over six bus routes nearby, public transport is easily accessible. The area is alive with local businesses, cafes, and restaurants for your convenience. Additionally, residing in this location places you within the coveted zones for Glen Waverley South Primary School and Glen Waverley Secondary College, making it an ideal home for families looking for quality education options.,Photo ID required at all open for inspections.",Ya Fei Dong,04506063...,Vita Liu,04120496...,144667500,"https://i2.au.reastatic.net/1136x696-resize,extend,r=33,g=40,b=46/8ee6775e7b79c290260cf69f0757911b5be0b310aa9175e85964d9b032d7c33e/image.jpg,https://i2.au.reastatic.net/1136x696-resize,extend,r=33,g=40,b=46/8ee6775e7b79c290260cf69f0757911b5be0b310aa9175e85964d9b032d7c33e/image.jpg,https://i2.au.reastatic.net/1136x696-resize,extend,r=33,g=40,b=46/c3b64a48294bb76825d771e63dc045dc072a029762621022eb0609f8ca48f0c6/image.jpg,https://i2.au.reastatic.net/1136x696-resize,extend,r=33,g=40,b=46/9b89ef18e7f695adbbfab4cb94cafc7bd68a374dbb02a0979d58e6ca7c5fe7a0/image.jpg,https://i2.au.reastatic.net/1136x696-resize,extend,r=33,g=40,b=46/fb14e6f1e6cf2b5b6d9e74c237cc828d0dd8f50b9f75934f978136b8f8c8b53e/image.jpg",https://www.realestate.com.au/property-unit-vic-glen+waverley-144667500
"922 High Street Road, Glen Waverley, Vic 3150","Auction $1,650,000 - $1,800,000",5,3,565m²,4,"A spacious and stylish sanctuary designed with family harmony in mind, this elevated residence exudes lifestyle appeal and offers a seamless blend of formal elegance and casual comfort, all within the catchment zones of two esteemed schools (STSA). Nestled conveniently on a service road, the home commands attention from its elevated position and welcomes you with a grand entrance foyer leading to a magnificent formal lounge featuring a cozy gas fireplace. Perfect for entertaining guests, the adjacent dining area is generously sized, while the expansive kitchen and family room area boasts premium finishes including stone benches, 900mm stainless steel appliances, a dishwasher, and a stunning waterfall island bench.,Newly renovated and newly landscaped, this home offers an additional layer of charm and appeal. A well-appointed study area complements the family space, and patio doors open onto a spectacular covered outdoor entertaining area, ideal for hosting BBQs with loved ones. Ascend the staircase to discover a fantastic retreat space and three bedrooms with ample storage, including a luxurious master suite with a walk-in robe and spa ensuite featuring dual vanities. Completing the upper level is a family bathroom and a separate toilet. The ground floor features a versatile study or fifth bedroom, alongside a powder room and a spacious laundry with ample storage and workspace.,Enhanced with solar panels, ducted heating, central and split system air conditioning, an alarm system, high ceilings, and under-stair storage, this home offers both comfort and convenience. A double garage with internal access adds to the appeal. Situated within the sought-after Mount View Primary and Highvale Secondary catchment areas (STSA), and in close proximity to Caulfield Grammar, The Glen Shopping Centre, Dandenong Creek Trail, public transportation options, Glen Waverley Train Station, as well as Monash and EastLink Freeways, this home truly offers the best of both worlds in terms of location and lifestyle.,Photo ID required at all open for inspections.",Winston Wei,04301460...,Hans Liu,04305955...,144671376,"https://i2.au.reastatic.net/1136x696-resize,extend,r=33,g=40,b=46/0290abf0a5da9adf20a0282c053420c06432382d707f147260678bf5a2ca8be1/image.jpg,https://i2.au.reastatic.net/1136x696-resize,extend,r=33,g=40,b=46/0290abf0a5da9adf20a0282c053420c06432382d707f147260678bf5a2ca8be1/image.jpg,https://i2.au.reastatic.net/1136x696-resize,extend,r=33,g=40,b=46/92fcefe58e5996e443f28b927ca3a94c029c94d2831c6c64b8dd75bcc0cf7f6a/image.jpg,https://i2.au.reastatic.net/1136x696-resize,extend,r=33,g=40,b=46/9f30cb548b1c71676bcccdc95579e53961fc93ab9af5373fc3940d05418eabd6/image.jpg,https://i2.au.reastatic.net/1136x696-resize,extend,r=33,g=40,b=46/3b4a1b31a22dc368477210a333dd49978a980b4cc97ac6a10e7edb1847b2099f/image.jpg",https://www.realestate.com.au/property-house-vic-glen+waverley-144671376
